headline,url
U.S. Extends Deadline for States on Health Insurance Exchanges,https://www.nytimes.com/2012/11/16/us/states-deadline-extended-for-insurance-exchanges.html
"Elections, Still Not Over in Arizona, a Hot Topic",https://www.nytimes.com/2012/11/16/us/politics/arizona-still-awaiting-some-election-results.html
Social and Anti-Social Media,https://campaignstops.blogs.nytimes.com/2012/11/15/social-and-anti-social-media/
"G.O.P. Governors Meet, Amid Whispers of 2016",https://www.nytimes.com/2012/11/16/us/politics/as-gop-governors-gather-prescriptions-for-2016.html
The Tarnish of the Electoral College,https://www.nytimes.com/2012/11/16/opinion/the-tarnish-of-the-electoral-college.html
Romney Pins Loss on Obama's 'Gifts',https://www.nytimes.com/video/us/politics/100000001906965/romney-pins-loss-on-obamas-gifts.html
Gay Vote Proved a Boon for Obama,https://www.nytimes.com/2012/11/16/us/politics/gay-vote-seen-as-crucial-in-obamas-victory.html
 'Lincoln' Is Shown at White House,https://thecaucus.blogs.nytimes.com/2012/11/15/lincoln-is-shown-at-white-house/
Spare Times for Children for Nov. 16-22,https://www.nytimes.com/2012/11/16/arts/spare-times-for-children-for-nov-16-22.html
Today's Scuttlebot: Musicians' Pennies and Funds' Facebook Shares,https://bits.blogs.nytimes.com/2012/11/15/todays-scuttlebot-musicians-pennies-and-funds-facebook-shares/
Museum and Gallery Listings for Nov. 16-22,https://www.nytimes.com/2012/11/16/arts/design/museum-and-gallery-listings-for-nov-16-22.html
Too Many Links,https://bittman.blogs.nytimes.com/2012/11/15/too-many-links/
Pop Listings for Nov. 16-22,https://www.nytimes.com/2012/11/16/arts/pop-listings-for-nov-16-22.html
Theater Listings for Nov. 16-22,https://www.nytimes.com/2012/11/16/theater/theater-listings-for-nov-16-22.html
"As the Crisis Is Revisited, Lawyers Win",https://www.nytimes.com/2012/11/16/business/bank-of-america-and-mbia-revisit-the-mortgage-debacle.html
Crossing the Line Between 'Immigrant' and 'American',https://www.nytimes.com/roomfordebate/2012/11/15/how-immigrants-come-to-be-seen-as-americans/
In a Blue Mood at the Algonquin Hotel,https://www.nytimes.com/2012/11/15/booming/algonquins-blue-bar-good-mood-big-tabs.html
Family Values,https://takingnote.blogs.nytimes.com/2012/11/15/family-values/
Demystifying the Fiscal Impasse That Is Vexing Washington,https://www.nytimes.com/2012/11/16/us/politics/the-fiscal-cliff-explained.html
Republicans in a Changing Country,https://douthat.blogs.nytimes.com/2012/11/15/republicans-in-a-changing-country/
Shares Fall a 3rd Day on Weak Forecasts,https://www.nytimes.com/2012/11/16/business/daily-stock-market-activity.html
Postal Service Reports Loss of $15 Billion,https://www.nytimes.com/2012/11/16/us/politics/postal-service-reports-a-nearly-16-billion-loss.html
"With Economy Still Trumping Emissions, Obama Plans an Education Push on Climate",https://dotearth.blogs.nytimes.com/2012/11/15/with-economy-still-trumping-emissions-obama-plans-an-education-push-on-climate/
No Comment Necessary: Fraud in Maine?,https://takingnote.blogs.nytimes.com/2012/11/15/no-comment-necessary-fraud-in-maine/
"Obama, Visiting New York, Pledges Help in Recovery From Storm",https://www.nytimes.com/2012/11/16/nyregion/obama-to-view-hurricane-sandy-recovery-in-new-york.html
The Moocher Majority,https://krugman.blogs.nytimes.com/2012/11/15/the-moocher-majority/
Opinion Report: The Cost of Sandy,https://takingnote.blogs.nytimes.com/2012/11/15/opinion-report-the-cost-of-sandy/
Fight Over Rice Exposes Tensions Between Obama and McCain,https://thecaucus.blogs.nytimes.com/2012/11/15/fight-over-rice-exposes-tensions-between-obama-and-mccain/
Divide and Be Conquered,https://latitude.blogs.nytimes.com/2012/11/15/the-president-of-argentina-ignores-discontent-at-her-peril/
Health Law Has States Feeling Tense Over Deadline,https://www.nytimes.com/2012/11/15/health/health-law-has-states-feeling-tense-over-deadline.html
"Crises at BBC Brought Rules, Then a Failure",https://www.nytimes.com/2012/11/15/world/europe/bbc-failures-show-limits-of-guidelines.html
Ex-Legislator From Queens Pleads Guilty in Bribe Case,https://www.nytimes.com/2012/11/15/nyregion/ex-assemblyman-meng-pleads-guilty-in-bribe-case.html
Standing Tougher,https://www.nytimes.com/2012/11/15/opinion/standing-tougher.html
Colorado: Interior Secretary Apologizes to Reporter,https://www.nytimes.com/2012/11/15/us/colorado-interior-secretary-apologizes-to-reporter.html
Kansas: Judge Allows Candidates to Contact Voters,https://www.nytimes.com/2012/11/15/us/kansas-judge-allows-candidates-to-contact-voters.html
Campaign Spending Truce?,https://www.nytimes.com/2012/11/15/opinion/campaign-spending-truce.html
Issues Raised by the Petraeus Scandal,https://www.nytimes.com/2012/11/15/opinion/issues-raised-by-the-petraeus-scandal.html
Changing Times,https://opinionator.blogs.nytimes.com/2012/11/14/changing-times/
Former Official Pleads Guilty to Defrauding Illinois Town of $53 Million,https://www.nytimes.com/2012/11/15/us/former-official-pleads-guilty-to-defrauding-illinois-town-of-53-million.html
Is the Voting Rights Act Doomed?,https://campaignstops.blogs.nytimes.com/2012/11/14/is-the-voting-rights-act-doomed/
Republican Governors Say Party Needs to Rebuild,https://thecaucus.blogs.nytimes.com/2012/11/14/republican-governors-say-party-needs-to-rebuild/
Pelosi ‘Wouldn’t Think of Walking Away’ From Job as Minority Leader,https://www.nytimes.com/2012/11/15/us/politics/nancy-pelosi-agrees-to-stay-on-as-house-minority-leader.html
Obama Meets C.E.O.’s as Fiscal Reckoning Nears,https://www.nytimes.com/2012/11/15/business/obama-seeks-new-start-with-executives.html
"Along Syrian Border, Lives Defined by War",https://www.nytimes.com/2012/11/15/world/middleeast/along-syrian-border-lives-defined-by-war.html
Romney Blames Loss on Obama 'Gifts',https://takingnote.blogs.nytimes.com/2012/11/14/romney-blames-loss-on-obama-gifts/
"Sorry, Folks: I’m Just Me",https://www.nytimes.com/2012/11/15/fashion/no-im-not-barbra-streisand.html
Marla Maples Finds Her Groove,https://www.nytimes.com/2012/11/15/fashion/for-marla-maples-a-return-to-new-york.html
Romney Blames Loss on Obama's 'Gifts' to Minorities and Young Voters ,https://thecaucus.blogs.nytimes.com/2012/11/14/romney-blames-loss-on-obamas-gifts-to-minorities-and-young-voters/
Obama Expresses Confidence in Early Action on Immigration,https://thecaucus.blogs.nytimes.com/2012/11/14/obama-expresses-confidence-in-early-action-on-immigration/
Analysis of Obama’s News Conference,https://www.nytimes.com/video/us/politics/100000001904133/timescast-politics-nov-14-2012.html
"The Bitter, The Tweets",https://www.nytimes.com/2012/11/15/fashion/justin-bieber-and-selena-gomez-are-splitsville-the-bitter-the-tweets.html
"Groups Obama Won, Groups Romney Won",https://www.nytimes.com/interactive/2012/11/10/opinion/20101104_POLL-MARSH.html
Fech 1.1 Released,https://open.blogs.nytimes.com/2012/11/14/fech-1-1-released/
Lee Atwater's 'Southern Strategy' Interview,https://takingnote.blogs.nytimes.com/2012/11/14/lee-atwaters-southern-strategy-interview/
Transcript of President Obama’s News Conference,https://www.nytimes.com/2012/11/14/us/politics/running-transcript-of-president-obamas-press-conference.html
Bright Passage,https://tmagazine.blogs.nytimes.com/2012/11/14/bright-passage/
On Our Radar: Revisiting the Rules That Weren't,https://green.blogs.nytimes.com/2012/11/14/on-our-radar-revisiting-the-rules-that-werent/
"Obama Details Lines of Battle in Budget Plan, and on Libya",https://www.nytimes.com/2012/11/15/us/politics/obama-holds-first-news-conference-since-june.html
"For Obama, No Easy Fix for Convoluted Regulatory System",https://dealbook.nytimes.com/2012/11/14/in-obamas-second-term-regulation-is-not-likely-to-be-simplified/
White House Style Watch Expands by 2,https://www.nytimes.com/2012/11/15/fashion/sasha-and-malia-obama-thrust-into-fashion-roles.html
Trading Away the Marlins’ Dignity,https://www.nytimes.com/2012/11/15/sports/the-marlins-no-1-problem.html
Senator-Elect Angus King of Maine to Align Himself With Democrats,https://thecaucus.blogs.nytimes.com/2012/11/14/senator-elect-angus-king-of-maine-to-caucus-with-democrats/
"Risking Defeat, Japan&#8217;s Premier Agrees to Dec. 16 Vote",https://www.nytimes.com/2012/11/15/world/asia/japans-leader-agrees-to-hold-december-elections.html
"The Breakfast Meeting: Petraeus's Lost Privacy, and Colbert's Disappearing 'Super PAC'",https://mediadecoder.blogs.nytimes.com/2012/11/14/the-breakfast-meeting-petraeuss-lost-privacy-and-colberts-disappearing-super-pac/
Shares Fall After Obama&#8217;s Tax Remarks,https://www.nytimes.com/2012/11/15/business/daily-stock-market-activity.html
Pelosi Will Remain Democratic Leader in House; Few Changes in Leadership,https://thecaucus.blogs.nytimes.com/2012/11/14/pelosi-to-remain-in-congress-and-continue-as-democratic-leader/
Letting Shareholders Know How Their Money Is Spent ,https://dealbook.nytimes.com/2012/11/14/letting-shareholders-know-how-their-money-is-spent/
"For Business Owners, the Health Care Details Begin to Emerge",https://boss.blogs.nytimes.com/2012/11/14/for-business-owners-the-health-care-details-begin-to-emerge/
The Early Word: Entanglements,https://thecaucus.blogs.nytimes.com/2012/11/14/the-early-word-entanglements/
Obama Vows Firm Stance on Deficit-Reduction Plan,https://www.nytimes.com/2012/11/14/us/politics/obama-tells-labor-leaders-hell-stand-tough-in-budget-talks.html
Notes for Next Time,https://campaignstops.blogs.nytimes.com/2012/11/13/notes-for-next-time/
French President Defends Record as Economy Struggles,https://www.nytimes.com/2012/11/14/world/europe/francois-hollande-of-france-defends-his-record.html
Newly Elected State Senator Defects to Republican Party,https://www.nytimes.com/2012/11/14/nyregion/newly-elected-state-senator-simcha-felder-defects-to-gop.html
Frosty Relations With Russia Begin to Thaw After Obama’s Re-election,https://www.nytimes.com/2012/11/14/world/europe/moscow-reopens-a-communication-channel-with-washington.html
Council Speaker Urges Stormproofing as the Civic Conversation Shifts,https://www.nytimes.com/2012/11/14/nyregion/council-speaker-quinn-urges-steps-to-protect-against-hurricanes.html
Ryan Sees Urban Vote as Reason G.O.P. Lost,https://www.nytimes.com/2012/11/14/us/politics/ryan-sees-urban-vote-as-reason-gop-lost.html
"Corrections: November 14, 2012",https://www.nytimes.com/2012/11/14/pageoneplus/corrections-november-14-2012.html
Congress Resumes With a G.O.P. Leadership Fight,https://www.nytimes.com/2012/11/14/us/politics/congress-resumes-with-a-gop-leadership-fight.html
Black Voters’ Momentum,https://www.nytimes.com/2012/11/14/opinion/black-voters-momentum.html
"To Impress Asia, Leave the Drama Home",https://www.nytimes.com/2012/11/14/opinion/obamas-subtle-game-will-impress-asians.html
Illinois: Jackson Leaves Clinic,https://www.nytimes.com/2012/11/14/us/illinois-jackson-leaves-clinic.html
What Next for the G.O.P.?,https://www.nytimes.com/roomfordebate/2012/11/13/what-next-for-the-republican-party/
Stephen Colbert Shuts Down 'Super PAC',https://thecaucus.blogs.nytimes.com/2012/11/13/stephen-colbert-shuts-down-super-pac/
Invitation to a Dialogue: Advice for the G.O.P.,https://www.nytimes.com/2012/11/14/opinion/invitation-to-a-dialogue-advice-for-the-gop.html
Identity Voters,https://krugman.blogs.nytimes.com/2012/11/13/identity-voters/
Will Obama Agree to Entitlement Cuts? He Already Has,https://thecaucus.blogs.nytimes.com/2012/11/13/will-obama-agree-to-entitlement-cuts-he-already-has/
Rick Sanchez to Join News Team at MundoFox,https://mediadecoder.blogs.nytimes.com/2012/11/13/rick-sanchez-to-join-news-team-at-mundofox/
Did the G.O.P. Win the Election?,https://takingnote.blogs.nytimes.com/2012/11/13/did-the-g-o-p-win-the-election/
"A Night of Glamour, and of Seriousness",https://runway.blogs.nytimes.com/2012/11/13/a-night-of-glamour-and-of-seriousness/
Ryan Surprised by Voters in 'Urban Areas' ,https://thecaucus.blogs.nytimes.com/2012/11/13/ryan-surprised-by-voters-in-urban-areas/
New Top Editor at Washington Post: Marcus Brauchli to Be Replaced by Martin Baron,https://mediadecoder.blogs.nytimes.com/2012/11/13/new-top-editor-at-washington-post-brauchli-to-be-replaced-by-marty-baron/
Parker Posey Gets to Work (and Gets to Throw a Fit on the Floor),https://6thfloor.blogs.nytimes.com/2012/11/13/parker-posey-gets-to-work-and-gets-to-throw-a-fit-on-the-floor/
Tough Times in Pittsburgh,https://www.nytimes.com/2012/11/14/sports/tough-times-in-pittsburgh-leading-off.html
France Grants Its Recognition to Syria Rebels,https://www.nytimes.com/2012/11/14/world/middleeast/syria-war-developments.html
"After Election Success, What's Next for U.S. Women?",https://rendezvous.blogs.nytimes.com/2012/11/13/after-election-success-whats-next-for-u-s-women/
What We're Reading,https://dinersjournal.blogs.nytimes.com/2012/11/13/what-were-reading-566/
The Early Word: Deductions,https://thecaucus.blogs.nytimes.com/2012/11/13/the-early-word-deductible/
A Texas Prosecutor Faces Justice,https://www.nytimes.com/2012/11/13/opinion/nocera-a-texas-prosecutor-faces-justice.html
Torrid Night Lays Bare Old Wounds,https://www.nytimes.com/2012/11/13/theater/reviews/yael-farbers-mies-julie-at-st-anns-warehouse.html
Diverse Backgrounds for 5 New Faces Sent to House,https://www.nytimes.com/2012/11/13/nyregion/new-faces-in-us-house-from-new-york-and-connecticut.html
Democrats Like a Romney Idea on Income Tax,https://www.nytimes.com/2012/11/13/us/politics/democrats-like-a-romney-idea-to-cap-tax-deductions.html
"Quotation of the Day for Tuesday, Nov. 13",https://www.nytimes.com/2012/11/13/pageoneplus/quotation-of-the-day-for-tuesday-nov-13.html
"Labor Leaders Have Obama’s Back, and Are Ready to Help",https://www.nytimes.com/2012/11/13/us/politics/unions-offer-support-for-president-obamas-tax-plan.html
Red Versus Blue in a New Light,https://campaignstops.blogs.nytimes.com/2012/11/12/red-versus-blue-in-a-new-light/
Angry Turkish Secularists Plant Their Flag at Trial,https://www.nytimes.com/2012/11/13/world/europe/angry-turkish-secularists-plant-flag-at-ergenekon-trial.html
Touring Wreckage on L.I. Amid Uncertainty in Albany,https://www.nytimes.com/2012/11/13/nyregion/skelos-examines-the-wreckage-in-nassau-county.html
"Secret of the Obama Victory? Rerun Watchers, for One Thing",https://www.nytimes.com/2012/11/13/us/politics/obama-data-system-targeted-tv-viewers-for-support.html
"In Analyzing Jets’ Failings, Start at the Top",https://www.nytimes.com/2012/11/13/sports/football/in-analyzing-jets-failings-start-at-the-top.html
Facebook’s False Faces Undermine Its Credibility,https://www.nytimes.com/2012/11/13/technology/false-posts-on-facebook-undermine-its-credibility.html
Arizona: Democrat Wins Close Race for Congress,https://www.nytimes.com/2012/11/13/us/arizona-democrat-wins-close-race-for-congress.html
The Fiscal Delusion,https://www.nytimes.com/2012/11/13/opinion/rubin-deluding-ourselves-over-the-fiscal-cliff.html
Top Candidates for State Dept. Are Both Facing Possible Hurdles,https://www.nytimes.com/2012/11/13/us/politics/top-candidates-to-replace-clinton-at-state-dept-may-face-hurdles.html
Academic ‘Dream Team’ Helped Obama’s Effort,https://www.nytimes.com/2012/11/13/health/dream-team-of-behavioral-scientists-advised-obama-campaign.html
TimesCast Media+Tech: When Memes Become Reality TV,https://bits.blogs.nytimes.com/2012/11/12/timescast-mediatech-when-memes-become-reality-tv/
Emotions Come to Fore in Political Wins and Losses,https://well.blogs.nytimes.com/2012/11/12/emotions-come-to-fore-in-political-wins-and-losses/
Scientists Hope Obama Continues Support for Basic Research,https://www.nytimes.com/2012/11/13/science/obamas-re-election-welcomed-by-many-science-researchers.html
The Romney Candidacy in Retrospect,https://douthat.blogs.nytimes.com/2012/11/12/the-romney-candidacy-in-retrospect/
"The Election: 'Vibrant,' 'Complex'",https://takingnote.blogs.nytimes.com/2012/11/12/the-election-vibrant-complex/
When Memes Become Reality TV,https://www.nytimes.com/video/business/media/100000001899404/when-memes-become-reality-tv.html
Death by Epistemology,https://krugman.blogs.nytimes.com/2012/11/12/death-by-epistemology/
My Unscientific World Poll of Obama vs. Romney,https://rendezvous.blogs.nytimes.com/2012/11/12/my-unscientific-world-poll-of-obama-vs-romney/
"Bill Kristol: Go Ahead, Raise Taxes",https://takingnote.blogs.nytimes.com/2012/11/12/bill-kristol-go-ahead-raise-taxes/
An Election Probably Shouldn't Change Your Financial Plan,https://bucks.blogs.nytimes.com/2012/11/12/an-election-probably-shouldnt-change-your-financial-plan/
Voting for U.N. Rights Council Puts Focus on Records of Panel's Member States,https://thelede.blogs.nytimes.com/2012/11/12/voting-for-u-n-rights-council-puts-focus-on-records-of-panels-member-states/
How Cellphones Complicate Polling,https://bits.blogs.nytimes.com/2012/11/12/how-cellphones-complicate-polling/
Will Higher Taxes Affect Small Businesses? You Tell Us,https://boss.blogs.nytimes.com/2012/11/12/will-higher-taxes-affect-small-businesses-you-tell-us/
"Turnout Steady in Swing States and Down in Others, But Many Votes Remain Uncounted",https://fivethirtyeight.blogs.nytimes.com/2012/11/12/turnout-steady-in-swing-states-and-down-in-others-but-many-votes-remain-uncounted/
Has Bibi Lost His Touch?,https://latitude.blogs.nytimes.com/2012/11/12/in-israeli-campaign-netanyahu-is-his-own-worst-enemy/
E.U. Postpones Charges for Airline Emissions,https://www.nytimes.com/2012/11/13/business/global/eu-postpones-charges-for-airline-emissions.html
"The Breakfast Meeting: MSNBC on the Rise, and Judgments on Martha, Conan and Bond",https://mediadecoder.blogs.nytimes.com/2012/11/12/the-breakfast-meeting-msnbc-on-the-rise-and-judgments-on-martha-conan-and-bond/
Leucadia to Acquire Jefferies,https://dealbook.nytimes.com/2012/11/12/leucadia-to-acquire-jefferies/
This Week in Small Business: Now What?,https://boss.blogs.nytimes.com/2012/11/12/this-week-in-small-business-now-what/
The Early Word: Strategy,https://thecaucus.blogs.nytimes.com/2012/11/12/the-early-word-strategy-3/
The Foreign Policy Agenda,https://www.nytimes.com/2012/11/12/opinion/president-obamas-foreign-policy-agenda.html
Officials Say F.B.I. Knew of Petraeus Affair in the Summer,https://www.nytimes.com/2012/11/12/us/us-officials-say-petraeuss-affair-known-in-summer.html
Hawks and Hypocrites,https://www.nytimes.com/2012/11/12/opinion/krugman-hawks-and-hypocrites.html
"In Debt Talks, Obama Is Ready to Go Beyond Beltway",https://www.nytimes.com/2012/11/12/us/politics/legacy-at-stake-obama-plans-broader-push-for-budget-deal.html
G.O.P. Strains to Define How to Close Gap With Voters,https://www.nytimes.com/2012/11/12/us/politics/first-republicans-must-find-common-ground-among-themselves.html
The Culture War and the Jobs Crisis,https://campaignstops.blogs.nytimes.com/2012/11/11/edsall-the-culture-war-and-the-jobs-crisis/
Connecticut Republicans Search for Answers After Their Dismal Election Day,https://www.nytimes.com/2012/11/12/nyregion/connecticut-republicans-search-for-answers-after-a-dismal-election-day.html
Should Marijuana Be Made Legal?,https://www.nytimes.com/2012/11/12/opinion/should-marijuana-be-made-legal.html
"Hard-Nosed Approach Wins Votes in the South, but Lacks Broader Appeal",https://www.nytimes.com/2012/11/12/us/southern-republicans-consider-changing-tone.html
"After the Returns, November Returns",https://www.nytimes.com/2012/11/12/opinion/after-the-returns-november-returns.html
Generational Shift in Black Christianity Comes to Harvard,https://www.nytimes.com/2012/11/12/us/a-shift-in-black-christianity-as-harvard-installs-a-minister.html
"To Slow Warming, Tax Carbon",https://www.nytimes.com/2012/11/12/opinion/on-climate-change-the-us-is-doing-better-than-europe.html
Business Chiefs Step Gingerly Into a Thorny Budget Fight,https://www.nytimes.com/2012/11/12/business/business-chiefs-step-gingerly-into-the-federal-budget-fight.html
The Anti-Fox Gains Ground,https://www.nytimes.com/2012/11/12/business/media/msnbc-its-ratings-rising-gains-ground-on-fox-news.html
Republicans’ Advice to Republicans,https://www.nytimes.com/2012/11/12/us/republicans-advice-to-republicans.html
Republicans’ Advice to Republicans,https://www.nytimes.com/2012/11/12/us/politics/republicans-advice-to-republicans.html
Google or Gallup? Changes in Voters’ Habits Reshape Polling World,https://www.nytimes.com/2012/11/12/us/politics/the-techniques-behind-the-most-accurate-polls.html
The Second Term Anti-Role Model: Bush,https://rendezvous.blogs.nytimes.com/2012/11/11/the-second-term-anti-role-model-bush/
Lawmakers Question F.B.I. Handling of Petraeus Affair,https://www.nytimes.com/2012/11/12/us/lawmakers-question-fbi-handling-of-petraeus-affair.html
"For One Night at Fox, News Tops Agenda",https://www.nytimes.com/2012/11/12/business/media/fox-newss-election-coverage-followed-journalistic-instincts.html
Result Won&#8217;t Limit Campaign Money Any More Than Ruling Did,https://www.nytimes.com/2012/11/12/us/politics/a-vote-for-unlimited-campaign-financing.html
Disruptions: Casting a Ballot by Smartphone,https://bits.blogs.nytimes.com/2012/11/11/disruptions-casting-a-ballot-by-smartphone/
Newswallah: Long Reads Edition ,https://india.blogs.nytimes.com/2012/11/11/newswallah-long-reads-edition-49/
"Amid Calls to Open China’s Politics, Party Digs In",https://www.nytimes.com/2012/11/11/world/asia/chinese-communist-party-faces-calls-for-democracy.html
Racism in Politics,https://campaignstops.blogs.nytimes.com/2012/11/10/racism-in-politics/
Boehner Tells House G.O.P. to Fall in Line,https://www.nytimes.com/2012/11/11/us/politics/boehner-tells-house-gop-to-fall-in-line.html
Which Polls Fared Best (and Worst) in the 2012 Presidential Race,https://fivethirtyeight.blogs.nytimes.com/2012/11/10/which-polls-fared-best-and-worst-in-the-2012-presidential-race/
"One Moves Right, the Other May Be Pushed",https://www.nytimes.com/2012/11/11/us/dewhurst-and-straus-as-a-texas-gop-microcosm.html
Romney Is President,https://www.nytimes.com/2012/11/11/opinion/sunday/dowd-romney-is-president.html
My President Is Busy,https://www.nytimes.com/2012/11/11/opinion/sunday/friedman-president-obama-is-busy.html
The Demographic Excuse,https://www.nytimes.com/2012/11/11/opinion/sunday/douthat-the-gops-demographic-excuse.html
A Landslide Loss for Big Money,https://www.nytimes.com/2012/11/11/opinion/sunday/a-landslide-loss-for-big-money.html
Hillary’s Next Move,https://www.nytimes.com/2012/11/11/opinion/sunday/collins-hillarys-next-move.html
The Oracle’s Debacle,https://www.nytimes.com/2012/11/11/opinion/sunday/bruni-the-oracles-debacle.html
Biographer’s E-Mails to Woman Led F.B.I. to Petraeus,https://www.nytimes.com/2012/11/11/us/fbi-said-to-have-stumbled-into-news-of-david-petraeus-affair.html
The Building Blocks of Re-election,https://www.nytimes.com/2012/11/11/sunday-review/the-building-blocks-of-re-election.html
"Sunday Breakfast Menu, Nov. 11",https://thecaucus.blogs.nytimes.com/2012/11/10/sunday-breakfast-menu-nov-11-2/
Unqualified,https://krugman.blogs.nytimes.com/2012/11/10/unqualified/
"A New Senator, Known Nationally and Sometimes Feared",https://www.nytimes.com/2012/11/11/us/politics/elizabeth-warren-known-and-maybe-feared-on-national-stage.html
Investor Doomsday? Not Necessarily,https://www.nytimes.com/2012/11/11/your-money/fiscal-impasse-now-takes-center-stage-for-investors.html
Vote Count Confirms Obama Win in Florida,https://www.nytimes.com/2012/11/11/us/politics/florida-to-address-delays-as-it-confirms-obama-victory.html
Disaster Reporting in the Backyard,https://www.nytimes.com/2012/11/11/public-editor/hurricane-reporting-in-the-backyard.html
Hurricane Sandy and the Disaster-Preparedness Economy,https://www.nytimes.com/2012/11/11/business/hurricane-sandy-and-the-disaster-preparedness-economy.html
"I Cry, Therefore I Am",https://www.nytimes.com/2012/11/11/opinion/sunday/i-cry-therefore-i-am.html
Political Racism in the Age of Obama,https://www.nytimes.com/2012/11/11/opinion/sunday/political-racism-in-the-age-of-obama.html
What Election?,https://www.nytimes.com/2012/11/11/opinion/sunday/what-election.html
The Choice Confronting Republican Governors,https://www.nytimes.com/2012/11/11/opinion/sunday/the-choice-confronting-republican-governors.html
Climate Change: Lessons From Ronald Reagan,https://www.nytimes.com/2012/11/11/opinion/sunday/climate-change-lessons-from-ronald-reagan.html
Thorsten Bauer,https://www.nytimes.com/2012/11/11/opinion/sunday/catching-up-with-thorsten-bauer.html
Women Fight to Define the Arab Spring,https://www.nytimes.com/2012/11/11/opinion/sunday/women-fight-to-define-the-arab-spring.html
The Food Movement Takes a Beating,https://opinionator.blogs.nytimes.com/2012/11/10/the-food-movement-takes-a-beating/
The Cliff Is a Hard Place to Compromise,https://www.nytimes.com/2012/11/11/sunday-review/the-cliff-is-a-hard-place-to-compromise.html
Chinese Official Reaffirms ‘Rebalancing’ of Economy,https://www.nytimes.com/2012/11/11/world/asia/chinese-official-reaffirms-rebalancing-of-economy.html
Delusions of Reason,https://krugman.blogs.nytimes.com/2012/11/10/delusions-of-reason/
The Weekend Word: Scandal,https://thecaucus.blogs.nytimes.com/2012/11/10/the-weekend-word-scandal/
Election Data Dive,https://www.nytimes.com/2012/11/10/opinion/blow-election-data-dive.html
Uncounted Votes in Arizona Raise Controversy,https://www.nytimes.com/slideshow/2012/11/09/us/20121110_BALLOTS.html
Pictures From the Week in Business,https://www.nytimes.com/slideshow/2012/11/10/business/weekly-business-photos.html
The Fiscal Cliff Opener,https://www.nytimes.com/2012/11/10/opinion/the-fiscal-cliff-opener.html
