headline,url
How to Read in 2013,https://www.nytimes.com/2012/12/30/opinion/sunday/douthat-how-to-read-in-2013.html
Why the Economy Needs Tax Reform,https://www.nytimes.com/2012/12/30/opinion/sunday/why-the-economy-needs-tax-reform.html
"Pakistan Lifts, Then Reinstates, YouTube Ban",https://thelede.blogs.nytimes.com/2012/12/29/pakistan-lifts-then-reinstates-youtube-ban/
Were Obama's Early Ads Really the Game Changer? ,https://fivethirtyeight.blogs.nytimes.com/2012/12/29/were-obamas-early-ads-really-the-game-changer/
A Festive Mood in Maine as Same-Sex Marriage Becomes Legal,https://www.nytimes.com/2012/12/30/us/same-sex-marriage-becomes-legal-in-maine.html
European Union Plans to Accentuate the Positive in 2013,https://rendezvous.blogs.nytimes.com/2012/12/29/european-union-to-accentuate-the-positive-in-2013/
What to Expect in New York in 2013,https://www.nytimes.com/interactive/2012/12/30/nyregion/new-york-in-2013.html
Republican Holiday Blues,https://www.nytimes.com/2012/12/29/opinion/republican-holiday-blues.html
Democratic Establishment Voices Support for Markey's Bid to Succeed Kerry ,https://thecaucus.blogs.nytimes.com/2012/12/28/democratic-establishment-voices-support-for-markeys-bid-to-succeed-kerry/
First in Fashion,https://www.nytimes.com/2012/12/30/fashion/michelle-obama-first-in-fashion.html
Summing Up a Year in Pictures,https://lens.blogs.nytimes.com/2012/12/28/summing-up-a-year-in-pictures/
Past Turmoil Leaves a Lasting Impression on Today’s Investors,https://www.nytimes.com/2012/12/29/your-money/advisers-say-investors-are-slow-to-overcome-anxiety.html
Carbon Taxes Make Ireland Even Greener,https://www.nytimes.com/2012/12/28/science/earth/in-ireland-carbon-taxes-pay-off.html
Time to Confront Climate Change,https://www.nytimes.com/2012/12/28/opinion/time-to-confront-climate-change.html
Answers to the Year in Questions,https://www.nytimes.com/2012/12/28/opinion/Schott-the-year-in-questions.html
Massachusetts: Markey Seeking Senate Seat,https://www.nytimes.com/2012/12/28/us/politics/massachusetts-markey-seeking-senate-seat.html
"Iran’s Slowing of Enrichment Efforts May Show It Wants a Deal, Analysts Say",https://www.nytimes.com/2012/12/28/world/middleeast/irans-slowing-of-enrichment-efforts-may-show-it-wants-deal.html
One-Stoplight Town Seeks Just One Mayor,https://www.nytimes.com/2012/12/28/us/one-stoplight-town-is-looking-for-someone-anyone-to-be-mayor.html
Museum and Gallery Listings for Dec. 28-Jan. 3,https://www.nytimes.com/2012/12/28/arts/design/museum-and-gallery-listings-for-dec-28-jan-3.html
"In a Weak Market for Mergers and Acquisitions, Signs of Strength",https://dealbook.nytimes.com/2012/12/27/in-a-weak-market-for-mergers-and-acquisitions-signs-of-strength/
E.P.A. Chief Set to Leave; Term Fell Shy of Early Hope,https://www.nytimes.com/2012/12/28/science/earth/lisa-p-jackson-of-epa-to-step-down.html
Gay Republicans Take Out Ad Criticizing Hagel,https://thecaucus.blogs.nytimes.com/2012/12/27/gay-republicans-take-out-ad-criticizing-hagel/
"As Swing Districts Dwindle, Can a Divided House Stand? ",https://fivethirtyeight.blogs.nytimes.com/2012/12/27/as-swing-districts-dwindle-can-a-divided-house-stand/
Japan Hints It May Revise an Apology on Sex Slaves,https://www.nytimes.com/2012/12/28/world/asia/japan-might-revise-apology-on-wartime-sex-slaves.html
The Year in Questions,https://www.nytimes.com/2012/12/27/opinion/Schott-the-year-in-questions.html
"In Gabon, Lure of Ivory Is Hard for Many to Resist",https://www.nytimes.com/2012/12/27/world/africa/in-gabon-lure-of-ivory-proves-hard-to-resist.html
Holiday Doldrums,https://www.nytimes.com/2012/12/27/opinion/blow-holiday-doldrums.html
The N.R.A. at the Bench,https://opinionator.blogs.nytimes.com/2012/12/26/the-n-r-a-at-the-bench/
Morsi Admits ‘Mistakes’ in Drafting Egypt’s Constitution,https://www.nytimes.com/2012/12/27/world/middleeast/morsi-admits-mistakes-in-drafting-egypts-constitution.html
Washington State Senators Cross Aisle and Tilt Ideological Balance,https://www.nytimes.com/2012/12/27/us/politics/washington-state-senators-cross-aisle-and-tilt-ideological-balance.html
Iran: Former President’s Children Sue Lawmaker,https://www.nytimes.com/2012/12/27/world/middleeast/iran-former-presidents-children-sue-lawmaker.html
From Tehran to the B Train ,https://opinionator.blogs.nytimes.com/2012/12/26/from-tehran-to-the-b-train/
Don’t Let Pro-Israel Extremists Sink Chuck Hagel,https://www.nytimes.com/2012/12/27/opinion/dont-let-pro-israel-extremists-sink-chuck-hagel.html
Dynamic Former Netanyahu Aide Shifts Israeli Campaign Rightward,https://www.nytimes.com/2012/12/27/world/middleeast/naftali-bennett-pushes-netanyahu-rightward.html
Senators to Return With 5 Days Left and No Clear Fiscal Path,https://www.nytimes.com/2012/12/27/us/politics/little-sense-of-fiscal-urgency-as-senators-prepare-to-return.html
This Year in Small Business: Not Impressed!,https://boss.blogs.nytimes.com/2012/12/26/this-year-in-small-business-not-impressed/
IHT Quick Read: Dec. 26,https://rendezvous.blogs.nytimes.com/2012/12/26/iht-quick-read-dec-26/
"First Fighting Islamists, Now the Free Market",https://www.nytimes.com/2012/12/26/world/middleeast/egypts-hamdeen-sabahy-vs-islamists-and-free-markets.html
Give Chuck a Chance,https://www.nytimes.com/2012/12/26/opinion/friedman-give-chuck-a-chance.html
"For Akaka, a Senate Role as No. 1 on the Roll",https://www.nytimes.com/2012/12/26/us/politics/for-akaka-a-senate-role-as-no-1-on-the-roll.html
"Fired, but Firing Back, Over Dealings in Washington",https://www.nytimes.com/2012/12/26/us/fired-but-firing-back-over-dealings-in-washington.html
"Pats on the Back, and a Nod to Artistic Versatility",https://www.nytimes.com/2012/12/26/arts/television/kennedy-center-honors-letterman-and-led-zeppelin-on-cbs.html
"Ever Independent, Lieberman Moves On, Calling Partisan Fighting a ‘Cancer’",https://www.nytimes.com/2012/12/26/us/politics/joseph-i-lieberman-moves-on-to-greater-questions.html
"Clout Diminished, Tea Party Turns to Narrower Issues",https://www.nytimes.com/2012/12/26/us/politics/tea-party-its-clout-diminished-turns-to-fringe-issues.html
"Charles Durning, Prolific Character Actor, Dies at 89",https://www.nytimes.com/2012/12/26/movies/charles-durning-prolific-character-actor-dies-at-89.html
Officials Push to Postpone Swearing-In of Chávez,https://www.nytimes.com/2012/12/25/world/americas/hugo-chavez-aides-want-to-postpone-swearing-in.html
Food vs. Fuel in 2013,https://green.blogs.nytimes.com/2012/12/24/food-vs-fuel-in-2013/
Out in Africa,https://www.nytimes.com/2012/12/24/opinion/keller-out-in-africa.html
Search for Way Through Fiscal Impasse Turns to the Senate,https://www.nytimes.com/2012/12/24/us/politics/search-for-deal-in-fiscal-impasse-turns-to-senate.html
"A Look Back, and Beyond",https://www.nytimes.com/2012/12/24/sports/2012-a-look-back-at-the-year-in-sports-and-beyond.html
When Media’s Decision in the Face of Events Is to Say Nothing About Them,https://www.nytimes.com/2012/12/24/business/media/news-blackouts-for-security-or-serenity.html
Official Killed in Bombing Is Mourned in Pakistan,https://www.nytimes.com/2012/12/24/world/asia/bashir-ahmad-bilour-taliban-opponent-is-buried-in-pakistan.html
Philippine Law Forbids Abductions by Military,https://www.nytimes.com/2012/12/24/world/asia/philippine-law-forbids-abductions-by-military.html
The O’Reilly Factory,https://www.nytimes.com/2012/12/24/books/bill-oreilly-has-top-2-spots-on-hardcover-best-seller-list.html
Let the 2012 Presidential Campaign Books Begin,https://artsbeat.blogs.nytimes.com/2012/12/23/let-the-2012-presidential-campaign-books-begin/
Latina Liberals Vie for Senate Seat Left by Gallegos’s Death,https://www.nytimes.com/2012/12/23/us/alvarado-and-garcia-vie-to-replace-gallegos-in-texas-senate.html
Send in the Clowns,https://www.nytimes.com/2012/12/23/opinion/sunday/friedman-send-in-the-clowns.html
From Apocalypse to Dystopia,https://www.nytimes.com/2012/12/23/opinion/sunday/dowd-from-apocalypse-to-dystopia.html
A Father’s Journey,https://www.nytimes.com/2012/12/23/opinion/sunday/bruni-a-fathers-journey-on-gay-marriage.html
Getting It First or Getting It Right?,https://www.nytimes.com/2012/12/23/public-editor/getting-it-first-or-getting-it-right.html
Values Validate a First-Ballot Good Guy,https://www.nytimes.com/2012/12/23/sports/baseball/dale-murphys-high-road-doesnt-lead-to-hall-of-fame.html
"In India, a Dangerous and Divisive Technocrat",https://www.nytimes.com/2012/12/23/opinion/sunday/indias-divisive-technocrat.html
Philippines Enacts Strong Penalties for Abductions by Security Forces,https://www.nytimes.com/2012/12/23/world/asia/philippines-enacts-strong-penalties-for-abductions.html
The Weekend Word: N.R.A.,https://thecaucus.blogs.nytimes.com/2012/12/22/the-weekend-word-n-r-a/
Guns and Their Makers,https://www.nytimes.com/2012/12/22/opinion/nocera-guns-and-their-makers.html
Events in New Jersey,https://www.nytimes.com/2012/12/23/nyregion/events-in-new-jersey.html
"Georgia: Parliament Pardons 3,500 Prisoners",https://www.nytimes.com/2012/12/22/world/europe/georgian-parliament-pardons-3500-prisoners.html
"Football, and It’s Not Political",https://www.nytimes.com/2012/12/22/sports/football/senator-rubio-follows-the-nfl-like-a-regular-fan.html
Justice Dept. and Puerto Rico Agree to Overhaul the Island’s Troubled Police Force,https://www.nytimes.com/2012/12/22/us/justice-dept-and-puerto-rico-agree-to-overhaul-the-islands-troubled-police-force.html
A Year of Few Dull Moments,https://www.nytimes.com/2012/12/23/automobiles/a-year-of-few-dull-moments.html
Beltway Stop in the Oscar Race,https://www.nytimes.com/2012/12/22/movies/awardsseason/dc-journey-for-lincoln-zero-dark-thirty-and-argo.html
No-Layoff Company Now Writes Profit-Sharing Checks,https://www.nytimes.com/2012/12/22/business/marvin-windows-and-doors-offers-workers-profit-sharing-checks.html
Q. and A.: The Avalanche at Tunnel Creek,https://www.nytimes.com/2012/12/22/sports/q-a-the-avalanche-at-tunnel-creek.html
The Images of 2012: New York,https://lens.blogs.nytimes.com/2012/12/21/the-images-of-2012-new-york/
Engineered Fish Moves a Step Closer to Approval,https://www.nytimes.com/2012/12/22/business/gene-altered-fish-moves-closer-to-federal-approval.html
"Even in Disarray, G.O.P. Has Power to Constrain Obama",https://www.nytimes.com/2012/12/22/us/politics/even-after-victory-president-remains-constrained-by-gop.html
"With Nomination, Kerry Has Chance to Reshape R&eacute;sum&eacute;",https://thecaucus.blogs.nytimes.com/2012/12/21/with-nomination-kerry-has-chance-to-reshape-resume/
"With Kerry’s Exit Expected, Hopefuls Wait in the Wings",https://www.nytimes.com/2012/12/22/us/departure-by-kerry-creates-senate-opportunities-in-massachusetts.html
Kerry Named for the Role of a Lifetime,https://www.nytimes.com/2012/12/22/us/politics/kerry-is-pick-for-secretary-of-state-official-says.html
IHT Quick Read: Dec. 21 ,https://rendezvous.blogs.nytimes.com/2012/12/21/iht-quick-read-dec-21/
Playing Taxes Hold ’Em,https://www.nytimes.com/2012/12/21/opinion/krugman-playing-taxes-hold-em.html
Session Could Prove Awkward for Perry,https://www.nytimes.com/2012/12/21/us/texas-legislative-session-could-be-awkward-for-perry.html
Tensions Rise in Baghdad With Raid on Official,https://www.nytimes.com/2012/12/21/world/middleeast/tensions-rise-in-baghdad-with-raid-on-sunni-official.html
"Corrections: December 21, 2012",https://www.nytimes.com/2012/12/21/pageoneplus/corrections-december-21-2012.html
"For Scott Brown, a Third Round in the Battle Against Partisan Gravity",https://fivethirtyeight.blogs.nytimes.com/2012/12/20/for-scott-brown-a-third-round-in-the-battle-against-partisan-gravity/
Resounding Victory in Indian Vote Nudges Polarizing Figure Closer to a Larger Race,https://www.nytimes.com/2012/12/21/world/asia/narendra-modi-polarizing-indian-politician-gains-power.html
Tensions Between Japan and South Korea Complicate Picture for U.S.,https://www.nytimes.com/2012/12/21/world/asia/japan-and-south-korea-tensions-complicate-us-efforts-on-security.html
Paper Tigers and Glass-jawed Bullies ,https://opinionator.blogs.nytimes.com/2012/12/20/paper-tigers-and-glass-jawed-bullies/
Boehner Cancels Tax Vote in Face of G.O.P. Revolt,https://www.nytimes.com/2012/12/21/us/politics/house-moves-toward-vote-on-boehners-backup-plan.html
Museum and Gallery Listings for Dec. 21-27,https://www.nytimes.com/2012/12/21/arts/design/museum-and-gallery-listings-for-dec-21-27.html
"CNN, Planning New Programming, Hires Jake Tapper From ABC",https://mediadecoder.blogs.nytimes.com/2012/12/20/jake-tapper-leaves-abc-news-for-cnn/
"Bloomberg, Incensed by Shooting, Vows Stiffer Fight to Rework Gun Laws",https://www.nytimes.com/2012/12/21/nyregion/bloomberg-vows-stiffer-fight-to-overhaul-us-gun-laws.html
"In Japan, a Test of Inflation Targets",https://www.nytimes.com/2012/12/21/business/in-japan-a-test-of-inflation-targets.html
Boomers and Millennials Feel a Need to Care for One Another,https://www.nytimes.com/2012/12/20/booming/boomers-and-millenneals-feel-a-need-to-care-for-each-other.html
Who's to Blame for the Fiscal Cliff Impasse?,https://takingnote.blogs.nytimes.com/2012/12/20/whos-to-blame-for-the-fiscal-cliff-impasse/
Modi Victory Speech Comes With Apology,https://india.blogs.nytimes.com/2012/12/20/gujarat-chief-minister-makes-unexpected-apology-with-victory-speec/
"Booker Studies Bid for Senate, Not Governor",https://www.nytimes.com/2012/12/21/nyregion/booker-wont-run-for-governor-eyes-senate-bid.html
Being French Means Never Having to Say...,https://rendezvous.blogs.nytimes.com/2012/12/20/being-french-means-never-having-to-say/
"Scenes From Rajkot, Gujarat on Election Day ",https://india.blogs.nytimes.com/2012/12/20/scenes-from-rajkot-gujarat-on-election-day/
Modi Inches Closer to India's Capital,https://india.blogs.nytimes.com/2012/12/20/gujarat-chief-minister-narendra-modis-victory-could-propel-him-to-national-stag/
What They Said: The Gujarat and Himachal Pradesh Elections ,https://india.blogs.nytimes.com/2012/12/20/what-they-said-the-gujarat-and-himachal-pradesh-elections/
Modi's Magic Number,https://india.blogs.nytimes.com/2012/12/20/how-many-seats-gujarat-chief-minister-modi-wins-today-likely-to-signal-chances-as-prime-minister/
Bank of Japan Will Talk About Inflation Target,https://www.nytimes.com/2012/12/21/business/global/bank-of-japan-increases-economic-stimulus.html
IHT Quick Read: Dec. 20,https://rendezvous.blogs.nytimes.com/2012/12/20/iht-quick-read-dec-20/
Congress Poised to Wrestle Himachal Pradesh From B.J.P. ,https://india.blogs.nytimes.com/2012/12/20/congress-close-to-winning-himachal-pradesh/
A New Start for the Koreas (or Not) ,https://rendezvous.blogs.nytimes.com/2012/12/20/a-new-start-for-the-koreas-or-not/
Mr. Abe’s Second Chance,https://www.nytimes.com/2012/12/20/opinion/shinzo-abes-second-chance-in-japan.html
Egypt: Constitution Panelist Quits,https://www.nytimes.com/2012/12/20/world/middleeast/egyptian-constitution-panelist-quits.html
Both Sides Stand Firm on Details: You First,https://thecaucus.blogs.nytimes.com/2012/12/19/both-sides-stand-firm-on-details-you-first/
"Weighing Mayoral Bid, and Shaking Up the Race",https://www.nytimes.com/2012/12/20/nyregion/lhota-upends-mayoral-race-as-he-weighs-candidacy.html
Foundation Seeks Focus on Business in 2013 Race,https://www.nytimes.com/2012/12/20/nyregion/rockefeller-foundation-aims-to-push-business-concerns-to-forefront-of-new-york-mayors-race.html
Next Challenge for the Health Law: Getting the Public to Buy In,https://www.nytimes.com/2012/12/20/us/officials-confront-skepticism-over-health-law.html
The N.R.A. Protection Racket,https://www.nytimes.com/2012/12/20/opinion/the-nra-protection-racket.html
The Battlefront in the Front Yard,https://www.nytimes.com/2012/12/20/garden/gardeners-fight-with-neighbors-and-city-hall-over-their-lawns.html
Challenging France to Do Business Differently,https://www.nytimes.com/2012/12/20/business/global/challenging-france-to-do-business-differently.html
A Conservative Whose Supreme Court Bid Set the Senate Afire,https://www.nytimes.com/2012/12/20/us/robert-h-bork-conservative-jurist-dies-at-85.html
General Grant's Infamous Order,https://opinionator.blogs.nytimes.com/2012/12/19/general-grants-infamous-order/
Obama Chosen as Time Magazine's Person of the Year,https://thecaucus.blogs.nytimes.com/2012/12/19/obama-chosen-as-time-magazines-person-of-the-year/
God Save the British Economy,https://www.nytimes.com/2012/12/23/magazine/god-save-the-british-economy.html
Haggling Over Hagel,https://latitude.blogs.nytimes.com/2012/12/19/haggling-over-hagel/
Treasury to Sell G.M. Stake Within 15 Months,https://dealbook.nytimes.com/2012/12/19/treasury-to-sell-g-m-stake-within-15-months/
The Early Word: Guns,https://thecaucus.blogs.nytimes.com/2012/12/19/the-early-word-guns/
What Will You Remember Most From 2012?,https://learning.blogs.nytimes.com/2012/12/19/what-will-you-remember-most-from-2012/
Ex-Dictator’s Daughter Elected President as South Korea Rejects Sharp Change,https://www.nytimes.com/2012/12/20/world/asia/south-koreans-vote-in-closely-fought-presidential-race.html
What’s On Wednesday,https://www.nytimes.com/2012/12/19/arts/television/whats-on-wednesday.html
"To Japan-China Row, Add One Potential Provocateur ",https://rendezvous.blogs.nytimes.com/2012/12/19/to-japan-china-row-add-one-potential-provocateur/
How the N.R.A. Rates Lawmakers,https://www.nytimes.com/interactive/2012/12/19/us/politics/nra.html
Spain: Separatist Catalan Parties Announce Alliance,https://www.nytimes.com/2012/12/19/world/europe/separatist-catalan-parties-announce-alliance.html
Obama Facing Critical Choice After Shooting,https://www.nytimes.com/2012/12/19/us/politics/president-obama-facing-critical-choice-after-newtown-shooting.html
"Revenue Up, Oracle Posts 18% Increase In Profit",https://www.nytimes.com/2012/12/19/business/oracles-profit-climbs-18.html
Obama’s Weakness on Treaties,https://www.nytimes.com/2012/12/19/opinion/obamas-weakness-on-treaties.html
Bronx Judge Is Censured by Judicial Commission,https://cityroom.blogs.nytimes.com/2012/12/18/bronx-judge-is-censured-by-judicial-commission/
M.T.A. Chief Will Resign as He Looks at Mayoral Bid,https://www.nytimes.com/2012/12/19/nyregion/eyeing-mayoral-bid-mta-chief-will-step-down.html
When Trade Shows Were Both Grand and Central,https://cityroom.blogs.nytimes.com/2012/12/18/when-trade-shows-were-both-grand-and-central/
"Special News Quiz | Farewell, 2012",https://learning.blogs.nytimes.com/2012/12/18/special-news-quiz-farewell-2012/
Obama Talks to Pro-Gun Senator; White House Sketches Policy Shift,https://thecaucus.blogs.nytimes.com/2012/12/18/obama-talks-to-pro-gun-senator-white-house-sketches-policy-shift/
The President Negotiates With Himself,https://takingnote.blogs.nytimes.com/2012/12/18/the-president-negotiates-with-himself/
"France Opens the Door to a Right to Die, but Not Now",https://rendezvous.blogs.nytimes.com/2012/12/18/france-opens-the-door-to-a-right-to-die-but-not-now/
Reaction to Newtown Shootings Spreads to Corporate America,https://thecaucus.blogs.nytimes.com/2012/12/18/a-rising-chorus-but-not-quite-consensus-on-guns/
Hands Off Germany's Neo-Nazi Party,https://latitude.blogs.nytimes.com/2012/12/18/hands-off-germanys-neo-nazi-party/
The Early Word: Deal?,https://thecaucus.blogs.nytimes.com/2012/12/18/the-early-word-deal/
"Silent Since Shootings, N.R.A. Could Face Challenge to Political Power",https://www.nytimes.com/2012/12/18/nyregion/silent-since-shootings-nra-could-face-challenge-to-political-power.html
IHT Quick Read: Dec. 18,https://rendezvous.blogs.nytimes.com/2012/12/18/iht-quick-read-dec-18/
Party Identity in a Gun Cabinet,https://fivethirtyeight.blogs.nytimes.com/2012/12/18/in-gun-ownership-statistics-partisan-divide-is-sharp/
"Daniel Inouye, Hawaii’s Quiet Voice of Conscience in Senate, Dies at 88",https://www.nytimes.com/2012/12/18/us/daniel-inouye-hawaiis-quiet-voice-of-conscience-in-senate-dies-at-88.html
Senate Democrats Vote to Oust Their Leader,https://www.nytimes.com/2012/12/18/nyregion/senate-democrats-in-albany-replace-their-leader.html
"Symbol of Pride, Inverted, Is Now Symbol of Political Dismay",https://www.nytimes.com/2012/12/18/us/politics/upside-down-flags-mark-conservative-anger-on-obama.html
South Korea Vote Will Change Policy Toward North,https://www.nytimes.com/2012/12/18/world/asia/with-south-korean-election-policy-toward-north-will-change.html
‘This Is America Now’,https://www.nytimes.com/2012/12/18/theater/aasif-mandvi-beyond-the-daily-show.html
"After Tragedy, Partisanship May Cool a Bit",https://www.nytimes.com/2012/12/18/us/politics/newtown-tragedy-may-soften-hearts-in-washington.html
"In Recent Years, a Drop in Public Support for Gun Control Laws",https://thecaucus.blogs.nytimes.com/2012/12/17/in-recent-years-a-drop-in-public-support-for-gun-control-laws/
"No Deal, Continued",https://krugman.blogs.nytimes.com/2012/12/17/no-deal-continued/
Accounts and People of Note in Advertising,https://www.nytimes.com/2012/12/17/business/media/accounts-and-people-of-note-in-advertising.html
Congressman Is Chosen to Succeed DeMint as South Carolina Senator,https://www.nytimes.com/2012/12/18/us/politics/congressman-picked-for-south-carolina-senate-seat.html
Is the Gun Lobby Invincible?,https://www.nytimes.com/roomfordebate/2012/12/17/is-the-gun-lobby-invincible/
Bank Shares Lead a Gain After Signs of Progress in the Budget Talks,https://www.nytimes.com/2012/12/18/business/daily-stock-market-activity.html
"The Breakfast Meeting: Reporting From Newtown, and a Puppet Provocateur",https://mediadecoder.blogs.nytimes.com/2012/12/17/the-breakfast-meeting-reporting-from-newtown-and-a-puppet-provocateur/
Modi Casts His Vote in Second Day of Gujarat Elections,https://india.blogs.nytimes.com/2012/12/17/modi-casts-his-vote-in-second-day-of-gujarat-elections/
Obama Expected to Name Kerry as Secretary of State,https://www.nytimes.com/2012/12/17/us/politics/obama-expected-to-name-kerry-as-secretary-of-state.html
Michigan Effort Shows G.O.P. Sway in State Contests,https://www.nytimes.com/2012/12/17/us/politics/republican-donors-make-gains-in-states.html
South Africa Since Mandela,https://www.nytimes.com/2012/12/17/opinion/keller-south-africa-since-mandela.html
Kuwaiti Protesters Blocked From Rallying Outside Parliament,https://www.nytimes.com/2012/12/17/world/middleeast/kuwaiti-protesters-blocked-from-rallying-outside-parliament.html
Actor Renounces His Citizenship in Snit Over French Tax Burden,https://www.nytimes.com/2012/12/17/world/europe/gerard-depardieu-says-he-is-giving-up-french-citizenship.html
Chávez Party Wins Vote Amid Uncertainty,https://www.nytimes.com/2012/12/17/world/americas/chavez-party-wins-vote-amid-uncertainty.html
Ailing Mayor of Boston Says He’s Still Up to the Job,https://www.nytimes.com/2012/12/17/us/menino-bostons-ailing-mayor-says-hes-up-to-job.html
Talks Highlight a Structural Divide,https://thecaucus.blogs.nytimes.com/2012/12/16/talks-highlight-a-structural-divide/
"With a Supermajority, California Democrats Begin to Make Plans",https://www.nytimes.com/2012/12/17/us/politics/for-california-democrats-supermajority-is-a-new-challenge.html
"‘These Tragedies Must End,’ Obama Says",https://www.nytimes.com/2012/12/17/us/politics/bloomberg-urges-obama-to-take-action-on-gun-control.html
Following the Tradition of Being Untraditional,https://www.nytimes.com/2012/12/17/arts/music/anthony-braxton-at-the-kennedy-center.html
Commenting on a Death Gets a Puppet in Trouble,https://www.nytimes.com/2012/12/17/business/media/la-comay-of-superxclusivo-stirs-anger-over-comments-on-mans-death.html
The Freedom of an Armed Society,https://opinionator.blogs.nytimes.com/2012/12/16/the-freedom-of-an-armed-society/
First Round of Voting Spurs Dispute in Egypt,https://www.nytimes.com/2012/12/17/world/middleeast/egypt-constitution-vote-results.html
Justice Dept. Shelved Ideas to Improve Gun Background Checks,https://www.nytimes.com/2012/12/16/us/politics/justice-dept-studied-and-shelved-ideas-to-bolster-gun-database.html
"Gustavo Archilla, an Inspiration for Gay Marriage, Dies at 96",https://www.nytimes.com/2012/12/16/nyregion/gustavo-archilla-whose-wedding-inspired-gay-marriage-advocates-dies-at-96.html
Soured History Hampers Talks Between Obama and Boehner,https://www.nytimes.com/2012/12/16/us/politics/soured-obama-boehner-relationship-complicates-fiscal-talks.html
"Abdessalam Yassine, Leader of Moroccan Opposition Movement, Dies at 84",https://www.nytimes.com/2012/12/16/world/africa/abdessalam-yassine-leader-of-moroccan-opposition-movement-dies-at-84.html
"Seeking Fresh Policies and Faces, Lawmakers Push for Term Limits",https://www.nytimes.com/2012/12/16/us/seeking-fresh-policies-and-faces-lawmakers-push-for-term-limits.html
Our Corrosive Guessing Games,https://www.nytimes.com/2012/12/16/opinion/sunday/bruni-our-corrosive-guessing-games.html
The World’s Worst War,https://www.nytimes.com/2012/12/16/sunday-review/congos-never-ending-war.html
Egypt: The Next India or the Next Pakistan?,https://www.nytimes.com/2012/12/16/opinion/sunday/friedman-egypt-the-next-india-or-the-next-pakista-.html
Watch Out Below!!!,https://www.nytimes.com/2012/12/16/opinion/sunday/watch-out-below.html
"Debate on Gun Control Is Revived, Amid a Trend Toward Fewer Restrictions",https://www.nytimes.com/2012/12/16/us/politics/connecticut-shooting-revives-gun-control-debate.html
The Decline of Evangelical America,https://www.nytimes.com/2012/12/16/opinion/sunday/the-decline-of-evangelical-america.html
Sunday Dialogue: The Wish-List Party,https://www.nytimes.com/2012/12/16/opinion/sunday/sunday-dialogue-the-wish-list-party.html
