headline,url
A New Job Description for Treasury Secretary,https://www.nytimes.com/2012/12/16/opinion/sunday/a-new-job-description-for-treasury-secretary.html
A Bread Shortage Is the First Big Test of a Transitional Council in Aleppo,https://www.nytimes.com/2012/12/16/world/middleeast/syrians-face-severe-bread-shortage-in-aleppo.html
"Used to Helping, a Chaplain Finds the Tables Turned",https://www.nytimes.com/2012/12/16/us/chaplain-with-traumatic-brain-injuries-finds-tables-turned.html
Egypt Islamists Expect Approval of Constitution,https://www.nytimes.com/2012/12/16/world/middleeast/egypt-draft-constitution-vote.html
Why Does the N.R.A. Oppose the Global Arms Trade Treaty?,https://rendezvous.blogs.nytimes.com/2012/12/15/why-does-the-n-r-a-oppose-the-global-arms-trade-treaty/
IHT Quick Read: Dec. 15,https://rendezvous.blogs.nytimes.com/2012/12/15/iht-quick-read-dec-15/
A Tragedy of Silence,https://www.nytimes.com/2012/12/15/opinion/blow-a-tragedy-of-silence.html
Events in New Jersey,https://www.nytimes.com/2012/12/16/nyregion/events-in-new-jersey.html
How Maps Helped Republicans Keep an Edge in the House,https://www.nytimes.com/2012/12/15/us/politics/redistricting-helped-republicans-hold-onto-congress.html
Obama’s Cautious Call for Action Sets Stage to Revive Gun Debate,https://www.nytimes.com/2012/12/15/us/politics/obamas-reaction-to-connecticut-shooting-sets-stage-for-gun-debate.html
A Political Pendulum in a Disgruntled Japan,https://www.nytimes.com/2012/12/15/world/asia/a-political-pendulum-in-a-disgruntled-japan.html
"A Political Brawler, Now Battling for Microsoft",https://www.nytimes.com/2012/12/15/technology/microsoft-battles-google-by-hiring-political-brawler-mark-penn.html
Obama Walks a Fine Line With Egyptian President,https://www.nytimes.com/2012/12/15/world/middleeast/obama-walks-a-fine-line-with-egyptian-president.html
Most Governors Refuse to Set Up Health Exchanges,https://www.nytimes.com/2012/12/15/us/most-states-miss-deadline-to-set-up-health-exchanges.html
Gun Control Advocates Predict Tougher Response to Shootings,https://thecaucus.blogs.nytimes.com/2012/12/14/gun-control-advocates-predict-tougher-response-to-shootings/
"Resources: Talking and Teaching About the Shooting in Newtown, Conn.",https://learning.blogs.nytimes.com/2012/12/14/resources-talking-and-teaching-about-the-shooting-in-newtown-connecticut/
German Lawmakers Seek to Ban Far-Right Party,https://www.nytimes.com/2012/12/15/world/europe/german-government-panel-seeks-to-ban-far-right-party.html
"Tax Plan Is Popular, but Not Quite Fair",https://www.nytimes.com/2012/12/15/business/plan-to-cap-deductions-is-setback-for-charities.html
"Moments Taut, Tawdry or Unscripted",https://www.nytimes.com/2012/12/16/arts/television/alessandra-stanleys-good-and-bad-tv-of-2012.html
Karl Rove's 'Social Welfare' Organization,https://takingnote.blogs.nytimes.com/2012/12/14/karl-roves-social-welfare-organization/
European Leaders Back Common Banking Rules,https://www.nytimes.com/2012/12/15/business/global/european-leaders-back-banking-regulation-but-delay-further-measures.html
Kirchner Stumbles Again,https://latitude.blogs.nytimes.com/2012/12/14/kirchner-on-the-offensive-against-media-giant/
The G.O.P.’s Existential Crisis,https://www.nytimes.com/2012/12/14/opinion/krugman-the-gops-existential-crisis.html
What’s On Friday,https://www.nytimes.com/2012/12/14/arts/television/whats-on-friday.html
"Hoping for a Senate Seat, the Friendliest of Rivals",https://www.nytimes.com/2012/12/14/us/politics/trey-gowdy-and-tim-scott-senate-aspirants-and-friendliest-of-rivals.html
Moody’s Downgrade Deepens Puerto Rico’s Economic Problems,https://www.nytimes.com/2012/12/14/business/moodys-downgrades-puerto-ricos-debt.html
"Hurricane Sandy&#8217;s Effects Leave Some Municipal Workers as Refugees, Too",https://www.nytimes.com/2012/12/14/nyregion/some-city-employees-lost-their-offices-in-the-hurricane.html
"Rice Ends Bid for Secretary of State, and Fight With G.O.P.",https://www.nytimes.com/2012/12/14/us/politics/rice-drops-bid-for-secretary-of-state-white-house-says.html
Back When Americans Were the ‘Illegals’,https://www.nytimes.com/2012/12/14/us/when-americans-were-illegal-immigrants-in-mexico.html
"When It Comes to Race for House Speaker, Secretiveness Rules",https://www.nytimes.com/2012/12/14/us/keeping-mum-on-race-for-texas-house-speaker-race.html
"In the Fiscal Debate, an Unvarnished Voice for Shielding Benefits",https://www.nytimes.com/2012/12/14/us/politics/bernard-sanders-a-voice-for-shielding-entitlements.html
Museum and Gallery Listings for Dec. 14-20,https://www.nytimes.com/2012/12/14/arts/design/museum-and-gallery-listings-for-dec-14-20.html
Even the Best City Hall Partnership Ever Can Have Differences,https://cityroom.blogs.nytimes.com/2012/12/13/even-the-best-city-hall-partnership-ever-can-have-differences/
"With Gap Wide and Time Short, Obama and Boehner Meet",https://www.nytimes.com/2012/12/14/us/politics/obama-and-boehner-to-meet-again-on-fiscal-talks.html
European Leaders Hail Accord on Banking Supervision,https://www.nytimes.com/2012/12/14/business/global/eu-leaders-hail-accord-on-banking-supervision.html
Simplifying the Fiscal Cliff Debate,https://douthat.blogs.nytimes.com/2012/12/13/simplifying-the-fiscal-cliff-debate/
Costly Toll for Republicans Who Voted for Gay Marriage,https://www.nytimes.com/2012/12/14/nyregion/saland-concedes-defeat-in-state-senate-race.html
New Jersey’s Pension Plan Is Said to Be in Trouble Despite Overhaul by Christie,https://www.nytimes.com/2012/12/14/business/despite-overhaul-new-jersey-pension-plan-said-to-be-in-deep-trouble.html
New Life for the Class Act?,https://newoldage.blogs.nytimes.com/2012/12/13/new-life-for-the-class-act/
N.F.I.B. Suffers the Post-Election Blues,https://boss.blogs.nytimes.com/2012/12/13/n-f-i-b-suffers-the-post-election-blues/
Gujarat Goes to the Polls ,https://india.blogs.nytimes.com/2012/12/13/gujarat-goes-to-the-polls/
The Meaning of Minority,https://www.nytimes.com/2012/12/13/opinion/blow-the-meaning-of-minority.html
"Of Many Woes, One Man’s Illness Threatens Venezuela’s Revolution",https://www.nytimes.com/2012/12/13/world/americas/hugo-chavezs-movement-threatened-by-his-health.html
Boehner Tries to Contain Defections on Fiscal Unity,https://www.nytimes.com/2012/12/13/us/politics/boehner-tries-to-contain-defections-on-fiscal-unity.html
Socialists Denounce Gérard Depardieu for Leaving France,https://www.nytimes.com/2012/12/13/world/europe/gerard-depardieu-called-pathetic-for-leaving-france.html
Canada Reviews Plans to Buy F-35 Fighter Jets,https://www.nytimes.com/2012/12/13/business/high-cost-leads-canada-to-study-plans-to-buy-f-35s.html
Voters and Web Privacy,https://www.nytimes.com/2012/12/13/opinion/voters-and-web-privacy.html
Hints at Steeper Road to Victory for Perceived Front-Runner in Mayor&#8217;s Race,https://www.nytimes.com/2012/12/13/nyregion/for-quinn-hints-of-a-steeper-road-to-victory-in-mayoral-race.html
"Investors Stay Calm, if Cautious, as Stalemate Simmers",https://www.nytimes.com/2012/12/13/business/investors-stay-calm-if-cautious-as-stalemate-simmers.html
Examining the Support for Same-Sex Marriage,https://bruni.blogs.nytimes.com/2012/12/12/examining-the-support-for-same-sex-marriage/
Cuomo Puts Campaign Finance on 2013 Agenda,https://cityroom.blogs.nytimes.com/2012/12/12/cuomo-puts-campaign-finance-on-2013-agenda/
"In a Farewell Speech, Lieberman Reflects on His Political Journey",https://www.nytimes.com/2012/12/13/nyregion/lieberman-in-senate-farewell-speech-reflects-on-his-political-journey.html
Christie Tells Barbara Walters He Isn't Too Heavy to Be President,https://cityroom.blogs.nytimes.com/2012/12/12/christie-tells-barbara-walters-he-isnt-too-heavy-to-be-president/
"Latino Groups Warn Congress to Fix Immigration, or Else",https://thecaucus.blogs.nytimes.com/2012/12/12/latino-groups-warn-congress-to-fix-immigration-or-else/
European Officials Agree to Central Oversight of Banks,https://www.nytimes.com/2012/12/13/business/global/eu-leaders-try-to-show-unity-on-bank-supervision.html
Time for National Voting Standards?,https://takingnote.blogs.nytimes.com/2012/12/12/time-for-national-voting-standards/
Video: Marc Andreessen on the Triumph of Software,https://bits.blogs.nytimes.com/2012/12/12/video-marc-andreessen-on-the-triumph-of-software/
"A Big Year for Conservatives on Twitter, if Not at the Ballot Box",https://thecaucus.blogs.nytimes.com/2012/12/12/a-big-year-for-conservatives-on-twitter-if-not-at-the-ballot-box/
Moving Forward in Tough Times,https://opinionator.blogs.nytimes.com/2012/12/12/making-progress-in-hard-times/
Live Blog: DealBook's Post-Election Conference,https://dealbook.nytimes.com/2012/12/12/live-blog-dealbooks-post-election-conference/
The Early Word: Labor,https://thecaucus.blogs.nytimes.com/2012/12/12/the-early-word-labor-2/
Can God Save Egypt?,https://www.nytimes.com/2012/12/12/opinion/friedman-can-god-save-egypt.html
North Koreans Launch Rocket in Defiant Act,https://www.nytimes.com/2012/12/12/world/asia/north-korea-launches-rocket-defying-likely-sanctions.html
IHT Quick Read: Dec. 12,https://rendezvous.blogs.nytimes.com/2012/12/12/iht-quick-read-dec-12/
British Plan for Gay Marriage Would Exclude Anglican Church,https://www.nytimes.com/2012/12/12/world/europe/british-plan-for-gay-marriage-would-exclude-anglican-church.html
G.O.P.’s Full Control in Long-Moderate North Carolina May Leave Lasting Stamp,https://www.nytimes.com/2012/12/12/us/politics/gop-to-take-control-in-long-moderate-north-carolina.html
Unlikely Backers in a Battle Over Taxes,https://www.nytimes.com/2012/12/12/business/top-executives-end-opposition-to-higher-taxes.html
"As Fiscal Talks Heat Up, Questions on Whether Boehner Can Get the Votes",https://www.nytimes.com/2012/12/12/us/politics/questions-on-whether-boehner-could-sell-a-budget-deal-to-gop.html
Attorney General Seeks to Force Disclosure of More Political Donors,https://www.nytimes.com/2012/12/12/nyregion/new-york-attorney-general-seeks-to-expose-more-political-donors.html
South Carolina Governor Closing In on Replacement for DeMint,https://thecaucus.blogs.nytimes.com/2012/12/11/south-carolina-governor-closing-in-on-replacement-for-demint/
Kaine Says He Is Optimistic About Immigration Overhaul,https://thecaucus.blogs.nytimes.com/2012/12/11/kaine-says-he-is-optimistic-about-immigration-overhaul/
Penguin to Publish 2012 Campaign Book From Authors of 'Game Change' ,https://mediadecoder.blogs.nytimes.com/2012/12/11/penguin-to-publish-2012-campaign-book-from-authors-of-game-change/
Wall Street Is Bracing for the Dodd-Frank Rules to Kick In,https://dealbook.nytimes.com/2012/12/11/wall-street-is-bracing-for-the-dodd-frank-rules-to-kick-in/
"Limits on Unions Pass in Michigan, Once a Mainstay",https://www.nytimes.com/2012/12/12/us/protesters-rally-over-michigan-union-limits-plan.html
"Loopholes to Some, Lifelines to Others",https://www.nytimes.com/2012/12/12/business/behind-tax-loopholes-some-worthy-goals.html
Why Everyone Is So Certain About Hillary 2016,https://rendezvous.blogs.nytimes.com/2012/12/11/why-everyone-is-so-certain-about-hillary-2016/
Evidence of Torture by Egyptian Islamists,https://thelede.blogs.nytimes.com/2012/12/11/evidence-of-torture-by-egyptian-islamists/
"Swashbucklers Transformed, and Now Much Tamer",https://dealbook.nytimes.com/2012/12/11/private-equity-firms-now-have-very-public-profiles/
An Architect of Wall Street Reform Prepares for Life After Politics,https://dealbook.nytimes.com/2012/12/11/an-architect-of-wall-street-reform-prepares-for-life-after-politics/
Why Hillary Clinton Would Be Strong in 2016 (It's Not Her Favorability Ratings),https://fivethirtyeight.blogs.nytimes.com/2012/12/11/why-hillary-clinton-would-be-strong-in-2016-its-not-her-favorability-ratings/
S.&amp;P. Closes Near Level Set on Election Day,https://www.nytimes.com/2012/12/12/business/daily-stock-market-activity.html
A Pocket Guide to Lobbying in the United States   ,https://india.blogs.nytimes.com/2012/12/11/a-pocket-guide-to-lobbying-in-the-united-states/
Cabinet Diversity Poses a Question for Obama,https://thecaucus.blogs.nytimes.com/2012/12/11/in-remaking-his-cabinet-obama-has-an-opportunity-to-break-barriers/
Tangled in Punctuation,https://afterdeadline.blogs.nytimes.com/2012/12/11/tangled-in-punctuation/
Declared Loser Proposes New Election Within French Party,https://www.nytimes.com/2012/12/12/world/europe/declared-loser-proposes-new-election-within-french-party.html
"In Talks, House Majority Weighs Loyalty to Voters",https://www.nytimes.com/2012/12/11/us/politics/in-talks-house-majority-weighs-loyalty-to-voters.html
Social Science Palooza III,https://www.nytimes.com/2012/12/11/opinion/brooks-social-science-palooza-iii.html
Pentagon Says Afghan Forces Still Need Assistance,https://www.nytimes.com/2012/12/11/world/asia/afghan-army-weak-as-transition-nears-pentagon-says.html
"Fallen Dean’s Life, Contradictory to Its Grisly End",https://www.nytimes.com/2012/12/11/nyregion/a-quick-descent-for-cecilia-chang-dean-at-st-johns.html
Michigan Labor Fight Cleaves a Union Bulwark,https://www.nytimes.com/2012/12/11/us/battle-over-labor-unions-cleaves-michigan.html
Chávez in Cuba for Cancer Surgery,https://www.nytimes.com/2012/12/11/world/americas/chavez-goes-to-cuba-for-cancer-surgery.html
Euro-Skeptics Turn Up Heat on Cameron,https://www.nytimes.com/2012/12/11/world/europe/euro-skeptics-turn-up-heat-on-cameron.html
The Diversity Inside a Children’s Book,https://www.nytimes.com/2012/12/11/opinion/the-diversity-inside-a-childrens-book.html
S.C. Governor Rules Out a 'Placeholder' Appointment to Replace DeMint,https://thecaucus.blogs.nytimes.com/2012/12/10/s-c-governor-rules-out-a-placeholder-appointment-to-replace-demint/
Republican Party Looks to Learn From 2012 Electoral Losses,https://thecaucus.blogs.nytimes.com/2012/12/10/republican-party-looks-to-learn-from-2012-electoral-losses/
Cuomo Rejects Criticism for Avoiding Senate Leadership Dispute,https://cityroom.blogs.nytimes.com/2012/12/10/cuomo-rejects-criticism-for-avoiding-senate-leadership-dispute/
Did the Mainstream Press Really Bungle the Campaign's  'Single Biggest Story'?,https://publiceditor.blogs.nytimes.com/2012/12/10/did-the-mainstream-press-really-bungle-the-campaigns-single-biggest-story/
"Obama, With Blue-Collar Backdrop, Pushes for Higher Taxes on the Richest",https://www.nytimes.com/2012/12/11/us/politics/obama-going-to-michigan-to-push-higher-taxes-for-richest.html
Moroccans Fear That Flickers of Democracy Are Fading,https://www.nytimes.com/2012/12/11/world/africa/moroccans-fear-that-flickers-of-democracy-are-fading.html
McDonald’s Sales Help Shares Inch Higher,https://www.nytimes.com/2012/12/11/business/daily-stock-market-activity.html
Congress Party Craters in Gujarat,https://india.blogs.nytimes.com/2012/12/10/congress-party-craters-in-gujarat/
The Early Word: Double Negatives,https://thecaucus.blogs.nytimes.com/2012/12/10/the-early-word-double-negatives/
"Anxiety Over Italy&#8217;s Future Devalues Its Bonds, and Spain&#8217;s",https://www.nytimes.com/2012/12/11/business/global/11iht-eurozone11.html
Housing Agency’s Flaws Revealed by Storm,https://www.nytimes.com/2012/12/10/nyregion/new-york-city-housing-agency-was-overwhelmed-after-storm.html
"113th Congress: This Time, It’s Out With the New",https://www.nytimes.com/2012/12/10/us/politics/election-brings-seasoned-politicians-to-congress.html
Will Vote for Rupees,https://india.blogs.nytimes.com/2012/12/10/will-vote-for-rupees/
Letters Show Miller’s Desire to Be Taken Seriously,https://www.nytimes.com/2012/12/10/sports/baseball/papers-on-marvin-miller-reveal-his-desire-to-be-taken-seriously.html
Rival to Merkel Is Officially Seeking Her Job,https://www.nytimes.com/2012/12/10/world/europe/social-democrats-formally-nominate-merkel-rival.html
Timeline of the New York City Housing Authority’s Response,https://www.nytimes.com/2012/12/10/nyregion/timeline-of-the-new-york-city-housing-authoritys-response.html
"Before More Cancer Surgery, Chávez Had Some Political Fences to Mend at Home",https://www.nytimes.com/2012/12/10/world/americas/chavez-put-party-unity-before-another-cancer-surgery.html
Understanding Immigration Reform,https://www.nytimes.com/roomfordebate/2012/12/09/understanding-immigration-reform/
Japan’s Plutonium Policy,https://www.nytimes.com/2012/12/10/opinion/japans-plutonium-policy.html
Romanians Vote in Parliamentary Elections,https://www.nytimes.com/2012/12/10/world/europe/romanians-vote-in-parliamentary-elections.html
Pacquiao Stunned in Sixth Round,https://www.nytimes.com/2012/12/09/sports/juan-manuel-marquez-knocks-out-manny-pacquiao-in-sixth-round.html
"Ignoring Planetary Peril, a Profound 'Disconnect' Between Science and Doha",https://rendezvous.blogs.nytimes.com/2012/12/09/ignoring-planetary-peril-profound-disconnect-between-science-and-doha/
"Corrections: December 9, 2012",https://www.nytimes.com/2012/12/09/pageoneplus/corrections-december-9-2012.html
Rally Protests Coalition in New York State Senate,https://www.nytimes.com/2012/12/09/nyregion/al-sharpton-leads-rally-denouncing-coalition-in-albany.html
Tax Arithmetic Shows Top Rate Is Just a Starter,https://www.nytimes.com/2012/12/09/us/politics/tax-arithmetic-shows-top-rate-is-just-a-starter-in-talks.html
Clinton’s Countless Choices Hinge on One: 2016,https://www.nytimes.com/2012/12/09/us/politics/hillary-clintons-countless-choices-could-hinge-on-2016-election.html
Italy’s Prime Minister to Quit After Losing Party Support,https://www.nytimes.com/2012/12/09/world/europe/italian-prime-minister-mario-monti-to-resign.html
"How a Fiscal Impasse, in 1990, Was Broken",https://thecaucus.blogs.nytimes.com/2012/12/08/how-a-fiscal-impasse-in-1990-was-broken/
Contributions Blackout Serves Many Functions,https://www.nytimes.com/2012/12/09/us/texas-campaign-contributions-blackout-serves-many-functions.html
A Lost Civilization,https://www.nytimes.com/2012/12/09/opinion/sunday/dowd-a-lost-civilization.html
The Years of Senator DeMint,https://www.nytimes.com/2012/12/09/opinion/sunday/douthat-the-years-of-senator-demint.html
"For Corporate Donors, Inauguration Details",https://www.nytimes.com/2012/12/09/us/politics/obama-team-outlines-four-corporate-donor-packages-for-inauguration.html
"Changing Affiliation Again, Former Governor of Florida Becomes a Democrat",https://www.nytimes.com/2012/12/09/us/politics/charlie-crist-former-florida-governor-joins-democratic-party.html
A Fringe Politician Moves to Japan’s National Stage,https://www.nytimes.com/2012/12/09/world/asia/shintaro-ishihara-right-wing-japanese-politician-makes-gains.html
Worry Tempers Joy Over Gay Marriage’s Moment in Court,https://www.nytimes.com/2012/12/09/us/gay-activists-weigh-possibilities-of-marriage-ruling.html
"Backing Off Added Powers, Egypt’s Leader Presses Vote",https://www.nytimes.com/2012/12/09/world/middleeast/egypt-protests.html
Events in New Jersey,https://www.nytimes.com/2012/12/09/nyregion/events-in-new-jersey.html
Quinn Backs Expansion of Campaign Spending,https://www.nytimes.com/2012/12/08/nyregion/quinn-supports-changing-rules-on-campaign-spending.html
Beyond the Fiscal Cliff,https://www.nytimes.com/2012/12/08/opinion/beyond-the-fiscal-cliff.html
"An Enemy of Brussels, and Not Afraid to Say So",https://www.nytimes.com/2012/12/08/world/europe/nigel-farages-anti-eu-message-finds-fans.html
Justices to Hear Two Challenges on Gay Marriage,https://www.nytimes.com/2012/12/08/us/supreme-court-agrees-to-hear-two-cases-on-gay-marriage.html
Corporate Money Allowed for Inaugural Donations,https://www.nytimes.com/2012/12/08/us/politics/obama-to-accept-corporate-donations-for-2013-inaugural-events.html
Rice in Limbo as Nomination Remains Uncertain,https://www.nytimes.com/2012/12/08/us/politics/awkward-limbo-for-rice-as-criticism-rages.html
Bad News for Campaign Finance ,https://takingnote.blogs.nytimes.com/2012/12/07/bad-news-for-campaign-finance/
Elections in New York: Time to Consider Reforms,https://www.nytimes.com/2012/12/08/opinion/elections-in-new-york-time-to-consider-reforms.html
2012 Election Ended With Deluge of Donations and Spending,https://thecaucus.blogs.nytimes.com/2012/12/07/2012-election-ended-with-deluge-of-donations-and-spending/
Campaign Postscript Offers a Peek at Debates on Security and Spending,https://thecaucus.blogs.nytimes.com/2012/12/07/campaign-postscript-offers-a-peek-at-debates-on-security-and-spending/
Video: Post-Hurricane Politics in New York City,https://cityroom.blogs.nytimes.com/2012/12/07/video-post-hurricane-politics-in-new-york-city/
Profiting From a Child’s Illiteracy,https://www.nytimes.com/2012/12/09/opinion/sunday/kristof-profiting-from-a-childs-illiteracy.html
Mitch McConnell Objects to Himself. So Do We. ,https://takingnote.blogs.nytimes.com/2012/12/07/mitch-mcconnell-objects-to-himself-so-do-we/
The Preamble,https://www.nytimes.com/2012/12/09/books/review/1775-by-kevin-phillips.html
Little Clarity on the Jobs Front,https://economix.blogs.nytimes.com/2012/12/07/little-clarity-on-the-jobs-front/
"Republicans Spent Big on Akin in Missouri, Only to Lose",https://thecaucus.blogs.nytimes.com/2012/12/07/republicans-spent-big-on-akin-in-missouri-only-to-lose/
Shares Are Mixed After Jobs Report,https://www.nytimes.com/2012/12/08/business/daily-stock-market-activity.html
Will Vote for Rupees,https://latitude.blogs.nytimes.com/2012/12/07/indias-cash-transfer-for-the-poor-is-an-electoral-gambit/
"After Olympics, India's Boxing and Archery Associations Out of Play",https://india.blogs.nytimes.com/2012/12/07/after-olympics-indias-boxing-and-archery-associations-out-of-play/
"Olympics Turmoil Can Be Solved With a Chat, Indian Official Says ",https://india.blogs.nytimes.com/2012/12/07/olympics-turmoil-can-be-solved-with-a-chat-indian-official-says/
G.O.P. Senate Deal: Diversity Takes Back Seat to Power in Albany,https://www.nytimes.com/2012/12/07/nyregion/in-gop-state-senate-deal-diversity-takes-back-seat.html
The Republican Glasnost,https://www.nytimes.com/2012/12/07/opinion/brooks-the-republican-glasnost.html
North Korea Gets Ready for Launching,https://www.nytimes.com/2012/12/07/world/asia/07iht-northkorea07.html
Bills Placing Limits on Unions Advance in Michigan Legislature,https://www.nytimes.com/2012/12/07/us/bills-placing-limits-on-unions-advance-in-michigan-legislature.html
"On ‘Daily Show,’ No Hug for Christie",https://www.nytimes.com/2012/12/07/nyregion/no-hug-for-gov-chris-christie-on-daily-show.html
Two Laws Are Welcomed After Midnight in Seattle,https://www.nytimes.com/2012/12/07/us/two-laws-are-welcomed-after-midnight-in-seattle.html
Administration Weighs Legal Action Against States That Legalized Marijuana Use,https://www.nytimes.com/2012/12/07/us/marijuana-initiatives-in-2-states-set-federal-officials-scrambling.html
The Great Gun Gag,https://opinionator.blogs.nytimes.com/2012/12/06/the-great-gun-gag/
"Two Senate Seats in South Carolina, but Few Democratic Prospects",https://fivethirtyeight.blogs.nytimes.com/2012/12/06/two-senate-seats-in-south-carolina-but-few-democratic-prospects/
Extralegal Drone Policy,https://www.nytimes.com/2012/12/07/opinion/extralegal-drone-policy.html
The Baby Boom Bump,https://www.nytimes.com/2012/12/07/opinion/the-baby-boom-bump.html
Museum and Gallery Listings for Dec. 7-13,https://www.nytimes.com/2012/12/07/arts/design/museum-and-gallery-listings-for-dec-7-13.html
Gauging the Storm's Impact on Hiring,https://economix.blogs.nytimes.com/2012/12/06/gauging-the-storms-impact-on-hiring/
Mark Kirk Is Returning to Senate,https://thecaucus.blogs.nytimes.com/2012/12/06/mark-kirk-is-returning-to-senate/
Tea Party Hero Is Leaving the Senate for a New Pulpit,https://www.nytimes.com/2012/12/07/us/politics/jim-demint-to-leave-senate-to-run-heritage-foundation.html
Obama Calls for Day of Service to Kick Off Inaugural Festivities,https://thecaucus.blogs.nytimes.com/2012/12/06/obama-calls-for-day-of-service-to-kick-off-inaugural-festivities/
Romney's Chief Strategist Dissects Campaign,https://thecaucus.blogs.nytimes.com/2012/12/06/romneys-chief-strategist-dissects-campaign/
"In Obama’s Plan to Tax Rich, $250,000 Figure May Mislead",https://www.nytimes.com/2012/12/07/business/obamas-tax-plan-would-spare-many-affluent-families.html
Out With the New in South Carolina,https://takingnote.blogs.nytimes.com/2012/12/06/out-with-the-new-in-south-carolina/
Elizabeth Warren Still Carrying Campaign Debt,https://thecaucus.blogs.nytimes.com/2012/12/06/elizabeth-warren-still-carrying-campaign-debt/
A Note for the Transit Chief: Beware the Endorsement From Giuliani,https://cityroom.blogs.nytimes.com/2012/12/06/a-note-for-the-transit-chief-beware-the-endorsement-from-giuliani/
How the 'Death With Dignity' Initiative Failed in Massachusetts,https://newoldage.blogs.nytimes.com/2012/12/06/how-the-death-with-dignity-law-died-in-massachusetts/
"In Gujarat's Gir Forest, India's Most Privileged Voter ",https://india.blogs.nytimes.com/2012/12/06/in-gujarats-gir-forest-indias-most-privileged-voter/
Boehner Gains Strong Backing From House Republicans,https://www.nytimes.com/2012/12/06/us/politics/boehner-gains-strong-backing-of-house-gop.html
Santorum Strikes Again,https://www.nytimes.com/2012/12/06/opinion/collins-santorum-strikes-again.html
Secularism in Search of a Nation,https://india.blogs.nytimes.com/2012/12/05/secularism-in-search-of-a-nation/
An Abduction Shines Light on Ukraine Asylum Policy and on Kremlin Methods,https://www.nytimes.com/2012/12/06/world/europe/abduction-shines-light-on-ukraine-asylum-and-kremlin-methods.html
Storm Writes a New Script in Campaigns for New York Mayor,https://www.nytimes.com/2012/12/06/nyregion/hurricane-sandy-alters-mayoral-campaign-in-nyc.html
