headline,url
Race to the Bottom,https://www.nytimes.com/2012/12/06/opinion/race-to-the-bottom.html
Republicans' Immigration Bill Blocked by Senate Democrats,https://thecaucus.blogs.nytimes.com/2012/12/05/republicans-immigration-bill-blocked-by-senate-democrats/
I Am Not Big Brother,https://www.nytimes.com/2012/12/06/opinion/i-am-not-big-brother.html
Recognizing the Opposition in Syria,https://www.nytimes.com/roomfordebate/2012/12/05/recognizig-the-opposition-in-syria/
Transcript of David Leonhardt's Reddit Chat,https://thecaucus.blogs.nytimes.com/2012/12/05/transcript-of-david-leonhardts-reddit-chat/
Obama Appeals to Business for Support on Tax Plan,https://www.nytimes.com/2012/12/06/us/politics/obama-tells-gop-not-to-tie-debt-ceiling-to-fiscal-debate.html
David Leonhardt Takes Questions on Reddit,https://thecaucus.blogs.nytimes.com/2012/12/05/david-leonhardt-takes-questions-on-reddit/
Pointed Pens ,https://rendezvous.blogs.nytimes.com/2012/12/05/pointed-pens/
Britons Are Warned of Lingering Austerity,https://www.nytimes.com/2012/12/06/business/global/austerity-in-britain-will-stretch-to-2018-osborne-says.html
"In Poll, New Yorkers Like Cuomo for Governor and Clinton for President",https://cityroom.blogs.nytimes.com/2012/12/05/new-york-voters-like-cuomo-as-governor-clinton-for-president/
A Closer Look at Ray Guy's Hall of Fame Candidacy,https://fifthdown.blogs.nytimes.com/2012/12/05/a-closer-look-at-ray-guys-hall-of-fame-candidacy/
Mighty Morphin Hillary,https://www.nytimes.com/2012/12/05/opinion/dowd-mighty-morphin-hillary.html
Lincolns in Wartime Hope for a Midnight Clear,https://www.nytimes.com/2012/12/05/theater/reviews/a-civil-war-christmas-by-paula-vogel-set-at-white-house.html
China’s Anticorruption Commission Investigates Senior Official,https://www.nytimes.com/2012/12/06/world/asia/early-target-of-chinas-anti-corruption-commission-identified.html
"Praising Immigrants, Bush Leads Conservative Appeal for G.O.P. to Soften Tone",https://www.nytimes.com/2012/12/05/us/praising-immigrants-george-w-bush-leads-conservative-appeal-for-gop-to-soften-tone.html
Rhode Island Judge Has Stake in Pension Case Outcome,https://www.nytimes.com/2012/12/05/business/rhode-island-judge-has-stake-in-pension-case-outcome.html
Ryan and Rubio Say Republicans Must Work on Aiding Middle Class,https://thecaucus.blogs.nytimes.com/2012/12/04/ryan-and-rubio-say-republicans-must-work-on-aiding-middle-class/
"Egyptians at the Palace Gates, Phones in Hand",https://thelede.blogs.nytimes.com/2012/12/04/egyptians-at-the-palace-gates-phones-in-hand/
"In Tax Fight, G.O.P. Seeks a Position to Fall Back On",https://www.nytimes.com/2012/12/05/us/politics/gop-seeks-fallback-position-on-tax-fight.html
"From Republicans, a Parting Slap at Bob Dole and Disabled Americans",https://takingnote.blogs.nytimes.com/2012/12/04/from-republicans-a-parting-slap-at-bob-dole-and-disabled-americans/
Fiscal Cliff Ahead: Cue the Extremists,https://takingnote.blogs.nytimes.com/2012/12/04/fiscal-cliff-ahead-cue-the-extremists/
Bush Urges Immigration Policy Reshaped With 'Benevolent Spirit' ,https://thecaucus.blogs.nytimes.com/2012/12/04/bush-urges-immigration-policy-reshaped-with-benevolent-spirit/
India&#8217;s Olympic Committee Is Suspended by the I.O.C.,https://www.nytimes.com/2012/12/05/sports/ioc-suspends-indias-olympic-committee.html
Coalition Is to Control State Senate as Dissident Democrats Join With Republicans,https://www.nytimes.com/2012/12/05/nyregion/malcolm-smith-defects-joining-dissenting-democrats.html
International Olympic Committee Suspends India,https://india.blogs.nytimes.com/2012/12/04/international-olympic-committee-suspends-india/
"In Campaign's Aftermath, Peering Into the 'Smoke-Filled Rooms'",https://lens.blogs.nytimes.com/2012/12/04/in-campaigns-aftermath-peering-into-the-smoke-filled-rooms/
The House Makes an ‘Offer’,https://www.nytimes.com/2012/12/04/opinion/speaker-john-boehner-makes-an-offer.html
Slovenian Protesters Denounce Graft and Budget Cuts,https://www.nytimes.com/2012/12/04/world/europe/slovenian-protesters-denounce-graft-and-budget-cuts.html
Change in Party Leaning Is No Surprise to Constituents,https://www.nytimes.com/2012/12/04/nyregion/simcha-felders-party-leaning-is-no-surprise-to-constituents.html
Obama Calls on Russia to Renew Weapons Pact,https://www.nytimes.com/2012/12/04/world/europe/obama-calls-on-russia-to-renew-weapons-pact.html
Mr. Netanyahu’s Strategic Mistake,https://www.nytimes.com/2012/12/04/opinion/benjamin-netanyahus-strategic-mistake.html
Stalled Budget Talks Cast a Long Shadow,https://www.nytimes.com/2012/12/04/business/media/stalled-budget-talks-cast-long-shadow.html
"Where Have You Gone, Bill Buckley?",https://www.nytimes.com/2012/12/04/opinion/where-have-you-gone-bill-buckley.html
Brothel Owner Raises Profile With Election Victory,https://www.nytimes.com/2012/12/04/us/nevada-brothel-owner-joining-county-commission.html
Republicans Who Have Opposed Leadership See Committee Assignments Stripped,https://thecaucus.blogs.nytimes.com/2012/12/03/republicans-who-have-opposed-leadership-see-committee-assignments-stripped/
Romney Campaign Manager Says He Regrets Immigration Stance,https://thecaucus.blogs.nytimes.com/2012/12/03/romney-campaign-manager-says-he-regrets-immigration-stance/
U.S. Warns Syria on Chemical Weapons,https://www.nytimes.com/2012/12/04/world/middleeast/nato-prepares-missile-defenses-for-turkey.html
Republicans Make Counteroffer in Fiscal Talks,https://www.nytimes.com/2012/12/04/us/politics/boehner-counters-obamas-proposal-on-deficit-cuts.html
Manufacturing News Sends Shares Down,https://www.nytimes.com/2012/12/04/business/daily-stock-market-activity.html
"After Re-election, Missouri Republican Decides to Leave Congress",https://thecaucus.blogs.nytimes.com/2012/12/03/after-re-election-missouri-republican-decides-to-leave-congress/
Obama to Ask Wasserman Schultz to Stay On as D.N.C. Chief,https://thecaucus.blogs.nytimes.com/2012/12/03/obama-to-ask-wasserman-schultz-to-stay-on-as-d-n-c-chief/
"The Breakfast Meeting: Network TV's Struggles, and the Pope to Add 'Followers' on Twitter",https://mediadecoder.blogs.nytimes.com/2012/12/03/the-breakfast-meeting-network-tvs-struggles-and-the-pope-to-add-followers-on-twitter/
"Trump Takes On a Farmer, and the Farmer Wins",https://cityroom.blogs.nytimes.com/2012/12/03/trump-takes-on-a-farmer-and-the-farmer-wins/
Winner Lose All,https://latitude.blogs.nytimes.com/2012/12/03/winner-lose-all/
"Criticized as Weak in Past Talks, Obama Takes Harder Line",https://www.nytimes.com/2012/12/03/us/politics/pushing-gop-to-negotiate-obama-ends-giving-in.html
The Big Budget Mumble,https://www.nytimes.com/2012/12/03/opinion/krugman-the-big-budget-mumble.html
Symbolism and Numerology in North Korean Rocketry,https://rendezvous.blogs.nytimes.com/2012/12/03/symbolism-and-numerology-in-north-korean-rocketry/
Young Immigrant Activists Cast a Wider Net,https://www.nytimes.com/2012/12/03/us/young-leaders-cast-a-wider-net-for-immigration-reform.html
DVR Use One Factor in Networks’ Low Ratings,https://www.nytimes.com/2012/12/03/business/media/dvrs-and-weak-shows-explain-low-ratings-for-tv-networks.html
What the 'Swing Counties' Tell Us About the Future of American Politics,https://rendezvous.blogs.nytimes.com/2012/12/02/what-the-swing-counties-tell-us-about-the-future-of-american-politics/
Operation Rolling Tantrum,https://krugman.blogs.nytimes.com/2012/12/02/operation-rolling-tantrum/
Negotiators Leading Talks on Fiscal Crisis Defend Stands,https://www.nytimes.com/2012/12/03/us/politics/geithner-and-boehner-defend-their-stands-on-fiscal-crisis.html
Egyptian Court Postpones Ruling on Constitutional Assembly,https://www.nytimes.com/2012/12/03/world/middleeast/egypt-morsi-constitution-vote.html
John McAfee Plays Hide-and-Seek in Belize,https://www.nytimes.com/2012/12/02/business/john-mcafee-plays-hide-and-seek-in-belize.html
Trusted Aide to Obama Faces Test in Budget Showdown,https://www.nytimes.com/2012/12/02/us/politics/obamas-aide-jacob-lew-is-a-low-key-power-broker.html
Make It One More Supreme Court Justice From the Perry Camp,https://www.nytimes.com/2012/12/02/us/jeffrey-boyd-is-7th-perry-appointee-on-texas-high-court.html
Nun Uses Music to Convey Spirited Message Against the Vatican’s Rebuke,https://www.nytimes.com/2012/12/02/us/nun-brings-music-and-strong-message-to-her-ministry.html
Dear President Clinton,https://www.nytimes.com/2012/12/02/opinion/sunday/bruni-dear-president-clinton.html
Letter From Syria,https://www.nytimes.com/2012/12/02/opinion/sunday/friedman-letter-from-syria.html
Dim Outlook for Hall of Fame Candidates,https://www.nytimes.com/2012/12/02/sports/baseball/dim-outlook-for-baseballs-hall-of-fame-candidates.html
"If Deal Is Not Reached, Impact Won’t Be Instant",https://thecaucus.blogs.nytimes.com/2012/12/01/if-deal-is-not-reached-impact-wont-be-instant/
Letters to the Editor,https://www.nytimes.com/2012/12/02/sports/letters-to-the-editor.html
When Partisans Became Partners,https://www.nytimes.com/2012/12/02/opinion/sunday/can-bipartisanship-work-it-did-in-1940.html
"Dividing the West Bank, and Deepening a Rift",https://www.nytimes.com/2012/12/02/world/middleeast/2-state-solution-at-risk-in-israeli-building-plan.html
What’s in Miami’s Bloodstream?,https://www.nytimes.com/2012/12/02/opinion/sunday/whats-in-miamis-bloodstream.html
Beyond Black and White in the Mississippi Delta,https://www.nytimes.com/2012/12/02/opinion/sunday/beyond-black-and-white-in-the-mississippi-delta.html
"Keeping Score: Also for Your Hall of Fame Consideration, Scott Boras ",https://bats.blogs.nytimes.com/2012/12/01/keeping-score-also-for-your-hall-of-fame-consideration-scott-boras/
Footing the Bill for Inaugural Dancing,https://www.nytimes.com/2012/12/02/opinion/sunday/footing-the-bill-for-inaugural-dancing.html
North Korea Says It Will Attempt to Test Another Long-Range Rocket,https://www.nytimes.com/2012/12/02/world/asia/north-korea-is-preparing-to-launch-another-long-range-rocket.html
Christmas Tree Controversy Fires Multicultural Belgium,https://rendezvous.blogs.nytimes.com/2012/12/01/christmas-tree-controversy-fires-multicultural-belgium/
"When Internal Polls Mislead, a Whole Campaign May Be to Blame ",https://fivethirtyeight.blogs.nytimes.com/2012/12/01/when-internal-polls-mislead-a-whole-campaign-may-be-to-blame/
Newswallah: Bharat Edition,https://india.blogs.nytimes.com/2012/12/01/newswallah-bharat-edition-66/
The Weekend Word: New Wave,https://thecaucus.blogs.nytimes.com/2012/12/01/the-weekend-word-new-wave/
Mitt’s Oval Office Moment,https://www.nytimes.com/2012/12/01/opinion/collins-mitts-oval-office-moment.html
Basketball Players’ Night Off Makes a Stand for Sitting Out,https://www.nytimes.com/2012/12/01/sports/basketball/david-stern-fines-spurs-for-day-off-raising-question-for-all-bosses.html
Events in New Jersey,https://www.nytimes.com/2012/12/02/nyregion/events-in-new-jersey.html
Young Immigrants Say It’s Obama’s Time to Act,https://www.nytimes.com/2012/12/01/us/dream-act-gives-young-immigrants-a-political-voice.html
What’s Missing in the Latest Greek Bailout,https://www.nytimes.com/2012/12/01/opinion/whats-missing-in-the-latest-greek-bailout.html
"In Latest Campaign, Obama Takes Deficit Battle to the Public",https://www.nytimes.com/2012/12/01/us/politics/obama-takes-his-deficit-fight-to-the-public.html
Battle Between Argentine Media Empire and President Heats Up Over a Law,https://www.nytimes.com/2012/12/01/world/americas/media-law-ratchets-up-battle-between-kirchner-and-clarin-in-argentina.html
Notes on Epistemic Closure,https://krugman.blogs.nytimes.com/2012/11/30/notes-on-epistemic-closure/
America’s Use of Drones: The Legality Issue,https://www.nytimes.com/2012/12/01/opinion/americas-use-of-drones-the-legality-issue.html
Polls Show Below-Average Post-Election Approval Bounce for Obama,https://fivethirtyeight.blogs.nytimes.com/2012/11/30/polls-show-below-average-post-election-approval-bounce-for-obama/
"For Obama, Difficult Timing of an Israeli Plan Is Nothing New",https://www.nytimes.com/2012/12/01/world/middleeast/news-of-israel-settlements-is-bad-timing-for-obama.html
Boehner Appoints a Woman to Lead the Administration Committee,https://thecaucus.blogs.nytimes.com/2012/11/30/boehner-appoints-a-woman-to-lead-the-administration-committee/
Johnson & Johnson Names New Chairman,https://www.nytimes.com/2012/12/01/business/johnson-johnson-names-new-chairman.html
Who Do Online Advertisers Think You Are?,https://www.nytimes.com/2012/12/02/magazine/who-do-online-advertisers-think-you-are.html
Obama Hits the Road to Rally Support for His Tax Plan,https://thecaucus.blogs.nytimes.com/2012/11/30/obama-hits-the-road-to-rally-support-for-his-tax-plan/
Dec. 2 — Dec. 8,https://www.nytimes.com/2012/12/02/arts/dec-2-dec-8.html
A Test For Liberalism,https://douthat.blogs.nytimes.com/2012/11/30/a-test-for-liberalism/
Nepal’s Political Leaders Given More Time to Agree on Government,https://www.nytimes.com/2012/12/01/world/asia/nepals-political-leaders-given-more-time-to-agree-on-government.html
South Korea’s Top Prosecutor Resigns Amid Scandals and Infighting,https://www.nytimes.com/2012/12/01/world/asia/south-koreas-top-prosecutor-resigns-amid-scandals.html
The 'Go Fast' and 'Go Big' Fiscal Challenges,https://economix.blogs.nytimes.com/2012/11/30/the-go-fast-and-go-big-fiscal-challenges/
Tax Burden for Most Americans Is Lower Than in the 1980s,https://www.nytimes.com/2012/11/30/us/most-americans-face-lower-tax-burden-than-in-the-80s.html
Rules for Targeted Killing,https://www.nytimes.com/2012/11/30/opinion/rules-for-targeted-killing.html
IHT Quick Read: Nov. 30 ,https://rendezvous.blogs.nytimes.com/2012/11/30/iht-quick-read-nov-30/
Class Wars of 2012,https://www.nytimes.com/2012/11/30/opinion/krugman-class-wars-of-2012.html
Prosecutions in Georgia Target Ex-Officials,https://www.nytimes.com/2012/11/30/world/europe/new-georgia-government-starts-punishing-members-of-old.html
"For Secretary of State, G.O.P. Pushes Old Hand",https://www.nytimes.com/2012/11/30/us/politics/gop-unites-around-john-kerry-for-secretary-of-state.html
What Is a Fair Tax Code?,https://www.nytimes.com/video/us/100000001910832/what-is-fair-.html
Suffolk County Turns a Page,https://www.nytimes.com/2012/11/30/opinion/suffolk-county-turns-a-page.html
A Liberal Moment,https://opinionator.blogs.nytimes.com/2012/11/29/a-liberal-moment/
"In Colorado, No Playbook for New Marijuana Law",https://www.nytimes.com/2012/11/30/us/colorado-authorities-seek-way-forward-on-marijuana.html
The Gun Frenzy,https://www.nytimes.com/2012/11/29/opinion/blow-the-gun-frenzy.html
Museum and Gallery Listings for Nov. 30-Dec. 6,https://www.nytimes.com/2012/11/30/arts/design/museum-and-gallery-listings-for-nov-30-dec-6.html
Chamber Competes to Be Heard in the Fiscal Debate,https://www.nytimes.com/2012/11/30/business/chamber-competes-to-be-heard-in-fiscal-debate.html
Theater Listings for Nov. 30-Dec. 6,https://www.nytimes.com/2012/11/30/theater/theater-listings-for-nov-30-dec-6.html
Racial Redefinition in Progress,https://www.nytimes.com/2012/11/30/arts/design/fore-at-studio-museum-in-harlem.html
"At Sundance, a Lot of James Franco and Other Experiments",https://carpetbagger.blogs.nytimes.com/2012/11/29/at-sundance-a-lot-of-james-franco-and-other-experiments/
Welcome to the Conspiracy Carnival,https://takingnote.blogs.nytimes.com/2012/11/29/welcome-to-the-conspiracy-carnival/
Romney Visits the White House,https://thecaucus.blogs.nytimes.com/2012/11/29/romney-arrives-to-dine-with-obama/
"Steven Spielberg, Historian",https://opinionator.blogs.nytimes.com/2012/11/29/steven-spielberg-historian/
Student Contest | Write a Rap About the News of 2012,https://learning.blogs.nytimes.com/2012/11/29/student-contest-write-a-rap-about-the-news-of-2012/
Hacking Report Says New Regulatory System Needed for British Newspapers,https://www.nytimes.com/2012/11/30/world/europe/leveson-report-phone-hacking-scandal-britain.html
Egyptian Islamists Approve Draft Constitution Despite Objections,https://www.nytimes.com/2012/11/30/world/middleeast/panel-drafting-egypts-constitution-prepares-quick-vote.html
"With Higher Taxes Looming, Bonuses May Come Early",https://economix.blogs.nytimes.com/2012/11/29/with-higher-taxes-looming-bonuses-may-come-early/
"U.S. Growth Revised Up, but Year-End Slowdown Is Feared",https://www.nytimes.com/2012/11/30/business/economy/third-quarter-gdp-growth-is-revised-up-to-2-7.html
Dropping the Ball on Financial Regulation ,https://economix.blogs.nytimes.com/2012/11/29/dropping-the-ball-on-financial-regulation/
U.S. Weighs Bolder Effort to Intervene in Syria’s Conflict,https://www.nytimes.com/2012/11/29/world/us-is-weighing-stronger-action-in-syrian-conflict.html
Health Care Entitlements,https://www.nytimes.com/2012/11/29/opinion/health-care-entitlements.html
Looking for Lessons In the 1990 Budget Deal,https://thecaucus.blogs.nytimes.com/2012/11/28/looking-for-lessons-in-the-1990-budget-deal/
Candidates Are Lining Up for Top Posts on ’13 Ballot,https://www.nytimes.com/2012/11/29/nyregion/races-for-top-offices-on-new-yorks-ballot-in-2013-take-shape.html
"Corrections: November 29, 2012",https://www.nytimes.com/2012/11/29/pageoneplus/corrections-november-29-2012.html
Big Issues Are Lost in Focus on Libya Talking Points,https://www.nytimes.com/2012/11/29/world/africa/with-focus-on-talking-points-benghazi-attacks-big-issues-fade.html
"On Drug Testing, Miller Wound Up at Odds With the Union",https://www.nytimes.com/2012/11/29/sports/baseball/marvin-millers-legacy-includes-opposition-to-drug-tests.html
Press Clips,https://opinionator.blogs.nytimes.com/2012/11/28/press-clips/
The Fight Over Susan Rice,https://takingnote.blogs.nytimes.com/2012/11/28/the-fight-over-susan-rice/
Obama Tilts Tax Debate Away From Spending Cuts,https://www.nytimes.com/2012/11/29/us/politics/president-obama-asks-congress-to-keep-tax-cuts-for-middle-class.html
A Not-So-Firm Deadline on a New Government in Nepal,https://www.nytimes.com/2012/11/29/world/asia/not-so-firm-deadline-on-new-government-in-nepal.html
"Jerry Finkelstein, New York Power Broker, Dies at 96",https://www.nytimes.com/2012/11/29/nyregion/jerry-finkelstein-new-york-power-broker-dies-at-96.html
"In Silicon Valley, Technology Talent Gap Threatens G.O.P. Campaigns",https://fivethirtyeight.blogs.nytimes.com/2012/11/28/in-silicon-valley-technology-talent-gap-threatens-g-o-p-campaigns/
Fiscal Ecstasy,https://opinionator.blogs.nytimes.com/2012/11/28/fiscal-ecstasy/
"Obama Calls Rice 'Extraordinary,' as Another Republican Voices Concerns",https://thecaucus.blogs.nytimes.com/2012/11/28/another-key-republican-senator-expresses-concern-over-rice/
John Boehner's Price,https://takingnote.blogs.nytimes.com/2012/11/28/john-boehners-price/
"For Obama and Romney, Lunch at the White House",https://thecaucus.blogs.nytimes.com/2012/11/28/for-obama-and-romney-lunch-at-the-white-house/
S.E.C. Weighs Suit Against SAC Capital ,https://dealbook.nytimes.com/2012/11/28/securities-and-exchange-commission-weighs-suing-sac-capital/
"As Opposition Coalition Meets in Cairo, More Violence Kills Dozens in Syria",https://www.nytimes.com/2012/11/29/world/middleeast/syria-war-developments.html
"Now Touring, the Debt Duo, Simpson-Bowles",https://www.nytimes.com/2012/11/28/us/politics/now-touring-the-debt-duo-simpson-bowles.html
California Finds Economic Gloom Starting to Lift,https://www.nytimes.com/2012/11/28/us/california-shows-signs-of-resurgence.html
The Pace of Leaving Afghanistan,https://www.nytimes.com/2012/11/28/opinion/the-pace-of-leaving-afghanistan.html
Hugo Chávez Will Go to Cuba for Medical Treatment,https://www.nytimes.com/2012/11/28/world/americas/hugo-chavez-will-go-to-cuba-for-medical-treatment.html
"In West’s ‘Democratopolis,’ Winning an Election With Only 8 of 39 Counties",https://www.nytimes.com/2012/11/28/us/politics/in-washington-state-victory-with-8-of-39-counties.html
The Debate Over Tax Rates and Breaks,https://www.nytimes.com/2012/11/28/opinion/the-debate-over-tax-rates-and-breaks.html
Hall of Fame Voters Confront the Steroid Era and Its Questions,https://www.nytimes.com/2012/11/28/sports/baseball/steroid-era-players-pose-difficulty-for-hall-of-fame-voters.html
Top Breakaway Democrat Favors G.O.P. Coalition in State Senate,https://www.nytimes.com/2012/11/28/nyregion/jeffrey-d-kleins-group-favors-coalition-with-new-york-senate-republicans.html
"For Latino Groups, Grass-Roots Efforts Paid Off in Higher Number of Voters",https://www.nytimes.com/2012/11/28/us/politics/for-latino-groups-grass-roots-efforts-paid-off-in-higher-number-of-voters.html
Still Dodging Reality on Taxes,https://www.nytimes.com/2012/11/28/opinion/republicans-still-dodge-reality-on-taxes.html
Miller Earned Respect as He Stood for Players’ Rights,https://www.nytimes.com/2012/11/28/sports/baseball/fay-vincent-marvin-miller-baseball-hall-of-fame.html
Grudges Loomed Large in Hall of Fame Snubs of Miller,https://www.nytimes.com/2012/11/28/sports/baseball/marvin-miller-grudges-likely-played-role-in-hall-of-fame-snub.html
A Struggling CNN Worldwide Is Said to Be Drawn to Jeffrey Zucker,https://www.nytimes.com/2012/11/28/business/media/jeffrey-zucker-expected-to-be-next-president-of-cnn.html
Mexico's President-Elect Discusses Immigration Policy With Obama,https://thecaucus.blogs.nytimes.com/2012/11/27/mexicos-president-elect-discusses-immigration-policy-with-obama/
A Ken Embraces His Many Barbies,https://www.nytimes.com/2012/11/29/fashion/the-designer-chris-benz-reaches-out-to-more-fans-up-close.html
Combating Inequality May Require Broader Tax,https://www.nytimes.com/2012/11/28/business/combatting-inequality-may-require-broader-tax.html
A New Leader Pushes a Different Side of Mexico,https://www.nytimes.com/2012/11/28/world/americas/mexico-seeks-to-recast-relationship-with-us.html
Rice Concedes Error on Libya; G.O.P. Digs In,https://www.nytimes.com/2012/11/28/us/politics/after-benghazi-meeting-3-republicans-say-concerns-grow-over-rice.html
A Bad Start on Immigration Reform,https://takingnote.blogs.nytimes.com/2012/11/27/a-bad-start-on-immigration-reform/
Life on the Voter-Fraud Fringe,https://takingnote.blogs.nytimes.com/2012/11/27/life-on-the-voter-fraud-fringe/
Is It Gay Husband? Lesbian Wife?  Or What?,https://www.nytimes.com/2012/11/27/booming/is-it-gay-husband-lesbian-wife-or-what.html
Bob Corker and the Romney Road Not Taken,https://douthat.blogs.nytimes.com/2012/11/27/bob-corker-and-the-romney-road-not-taken/
A Comment on the Budget Impasse Sends Markets Lower,https://www.nytimes.com/2012/11/28/business/daily-stock-market-activity.html
Ex-Foreign Minister Heads Party to Oppose Netanyahu,https://www.nytimes.com/2012/11/28/world/middleeast/ex-foreign-minister-forms-new-party-to-oppose-netanyahu.html
"Tax Cuts, Tax Rates and Tax Shares",https://economix.blogs.nytimes.com/2012/11/27/tax-cuts-tax-rates-and-tax-shares/
The Early Word: Give and Take,https://thecaucus.blogs.nytimes.com/2012/11/27/the-early-word-give-and-take/
Civil War Ravages Congo ,https://learning.blogs.nytimes.com/2012/11/27/civil-war-ravages-congo/
Efforts to Curb Social Spending Face Resistance,https://www.nytimes.com/2012/11/27/us/politics/politics-in-play-over-safety-net-in-deficit-talks.html
IHT Quick Read: Nov. 27,https://rendezvous.blogs.nytimes.com/2012/11/27/iht-quick-read-nov-27/
"North Korea May Be Planning Rocket Test, Satellite Operator Says",https://www.nytimes.com/2012/11/28/world/asia/north-korea-suspected-of-planning-rocket-test.html
When ‘Super PACs’ Become Lobbyists,https://www.nytimes.com/2012/11/27/opinion/when-super-pacs-become-lobbyists.html
Illinois Sets Election Dates to Replace Jackson in House,https://www.nytimes.com/2012/11/27/us/politics/illinois-sets-election-to-replace-jesse-l-jackson-jr.html
Fierce Debt Puts Pensions at Risk in Puerto Rico,https://www.nytimes.com/2012/11/27/business/puerto-rico-races-to-rescue-its-pension-fund.html
Israeli Military's Twitter Warrior Forced to Retreat After 'Obama Style' Blackface Joke,https://thelede.blogs.nytimes.com/2012/11/26/israeli-militarys-twitter-warrior-posed-obama-style-in-blackface/
Citizens United Ruling,https://www.nytimes.com/2012/11/27/opinion/citizens-united-ruling.html
The Lord of the Taxes,https://takingnote.blogs.nytimes.com/2012/11/26/the-lord-of-the-taxes/
Reality: Personal and National,https://www.nytimes.com/2012/11/27/theater/the-mies-julie-stars-hilda-cronje-and-bongile-mantsai.html
Intrade Bars U.S. Bettors After Regulatory Action,https://dealbook.nytimes.com/2012/11/26/after-regulatory-sanction-intrade-closes-to-u-s-investors/
French Center-Right Party Declares Sarkozy Protégé as Leader,https://www.nytimes.com/2012/11/27/world/europe/french-center-right-party-declares-jean-francois-cope-as-leader.html
Why Florida Really Changed Its Voting Rules,https://takingnote.blogs.nytimes.com/2012/11/26/why-florida-really-changed-its-voting-rules/
How Long Will it Take to Leave Afghanistan? ,https://takingnote.blogs.nytimes.com/2012/11/26/how-long-will-it-take-to-leave-afghanistan/
Debt Reckoning: Updates on the Fiscal Deadline,https://thecaucus.blogs.nytimes.com/2012/12/17/debt-reckoning-updates-on-the-fiscal-deadline/
How the N.H.L. Players' Union Would Decertify,https://slapshot.blogs.nytimes.com/2012/11/26/how-the-n-h-l-players-union-would-decertify/
Rebuilding Wall St.'s Watchdog ,https://dealbook.nytimes.com/2012/11/26/schapiro-head-of-s-e-c-to-announce-departure/
Off to the Races!,https://carpetbagger.blogs.nytimes.com/2012/11/26/back-to-the-races-let-the-awards-season-begin/
Rift in French Party Resists Mediation Attempt,https://www.nytimes.com/2012/11/27/world/europe/rift-in-french-party-resists-mediation-attempt.html
