headline,url
Advertising’s Moral Struggle: Is Online Reach Worth the Hurt?,https://www.nytimes.com/2016/12/26/business/media/advertising-online-ads-fake-news-google.html
"The C.I.A., Just Another Liberal Enemy",https://www.nytimes.com/2016/12/19/opinion/the-cia-just-another-liberal-enemy.html
"Trump Signs, Trees and Accusations That a New York Agency Is Biased",https://www.nytimes.com/2016/11/24/nyregion/how-trump-signs-led-to-a-tangle-over-city-trees.html
"‘It’s So Sad,’ Donald Trump Says of Syria, Promising ‘Safe Zones’",https://www.nytimes.com/2016/12/15/us/politics/syria-safe-zones-donald-trump.html
Mayor Shakes Up Media Operation Again,https://www.nytimes.com/2016/12/16/nyregion/mayor-shakes-up-media-operation-again.html
Could ‘Repeal and Delay’ of Obamacare Affect the Birthrate?,https://www.nytimes.com/2016/12/26/upshot/could-repeal-and-delay-of-obamacare-affect-the-birth-rate.html
Houses of Worship Poised to Serve as Trump-Era Immigrant Sanctuaries,https://www.nytimes.com/2016/12/27/us/houses-of-worship-poised-to-serve-as-trump-era-immigrant-sanctuaries.html
When Having Insurance Still Leaves You Dangerously Uncovered,https://www.nytimes.com/2016/11/28/upshot/when-having-insurance-still-leaves-you-dangerously-uncovered.html
Petrified Unity in Terror-Struck Berlin,https://www.nytimes.com/2016/12/23/opinion/petrified-unity-in-terror-struck-berlin.html
Fake News and the Internet Shell Game,https://www.nytimes.com/2016/11/28/opinion/fake-news-and-the-internet-shell-game.html
Trump Pressures Obama Over U.N. Resolution on Israeli Settlements,https://www.nytimes.com/2016/12/22/world/middleeast/donald-trump-united-nations-israel-settlements.html
Who Benefits From Market Speed Bumps? The Exchanges,https://www.nytimes.com/2016/12/23/business/dealbook/who-benefits-from-market-speed-bumps-the-exchanges.html
Resistance and Activism Against Donald Trump,https://www.nytimes.com/2016/12/16/opinion/resistance-and-activism-against-donald-trump.html
A Spotlight on Torture at Guantánamo,https://www.nytimes.com/2016/11/21/opinion/a-spotlight-on-torture-at-guantanamo.html
Los Angeles Drivers on the 405 Ask: Was $1.6 Billion Worth It?,https://www.nytimes.com/2016/12/20/us/los-angeles-drivers-on-the-405-ask-was-1-6-billion-worth-it.html
Deutsche Bank Flew and Fell. Some Paid a High Price.,https://www.nytimes.com/2016/12/30/business/dealbook/deutsche-bank-flew-and-fell-some-paid-a-high-price.html
"Cities Vow to Fight Trump on Immigration, Even if They Lose Millions",https://www.nytimes.com/2016/11/27/us/cities-vow-to-fight-trump-on-immigration-even-if-they-lose-millions.html
"In Russia, It’s Not the Economy, Stupid",https://www.nytimes.com/2016/12/25/opinion/in-russia-its-not-the-economy-stupid.html
"10 Engaging Proposals, From the Rooftop to the Subway",https://www.nytimes.com/2016/12/28/fashion/weddings/engaging-proposals-from-the-rooftop-to-the-subway.html
Fostering Civility in a Time of Disrespect,https://www.nytimes.com/2016/12/23/business/dealbook/fostering-civility-in-a-time-of-disrespect.html
Israel Wonders How Long Netanyahu Can Back Settlements and Two-State Solution,https://www.nytimes.com/2016/12/25/world/middleeast/netanyahu-accuses-obama-of-orchestrating-un-resolution.html
Trump Suggests Berlin Attack Affirms His Plan to Bar Muslims,https://www.nytimes.com/2016/12/21/us/politics/donald-trump-syria-policy.html
Obama Confronts Complexity of Using a Mighty Cyberarsenal Against Russia,https://www.nytimes.com/2016/12/17/us/politics/obama-putin-russia-hacking-us-elections.html
 Enough Conflicts to Fill the White House,https://www.nytimes.com/2016/12/16/opinion/enough-conflicts-to-fill-the-white-house.html
"Louis Harris, Pollster at Forefront of American Trends, Dies at 95",https://www.nytimes.com/2016/12/19/us/louis-harris-pollster-at-forefront-of-american-trends-dies-at-95.html
Deutsche Bank to Settle Mortgage Inquiry for $7.2 Billion,https://www.nytimes.com/2016/12/22/business/dealbook/deutsche-bank-mortgage-securities-justice-department-homeowners.html
Reality TV Populism,https://krugman.blogs.nytimes.com/2016/12/19/reality-tv-populism/
Hanukkah Event at a Trump Hotel Highlights a Rift Among Jews,https://www.nytimes.com/2016/12/15/us/jewish-groups-protest-hanukkah-party-at-trump-hotel.html
2 Convicted in New Jersey Bridge Scandal Seek New Trial,https://www.nytimes.com/2016/12/20/nyregion/2-convicted-in-new-jersey-bridge-scandal-seek-new-trial.html
"Trump Tower, the Center of the Political Universe",https://www.nytimes.com/interactive/2016/11/23/us/politics/trump-tower.html
Airbus Will Sell 100 Planes to Iran After Similar Boeing Deal,https://www.nytimes.com/2016/12/22/world/middleeast/iran-airbus-boeing-deal.html
U.S. Blacklists 15 Russian Entities Linked to Ukraine and Crimea,https://www.nytimes.com/2016/12/20/world/europe/us-blacklists-15-russian-entities-linked-to-ukraine-and-crimea.html
"A Cruel Test for Germany, and Europe",https://www.nytimes.com/2016/12/20/opinion/a-cruel-test-for-germany-and-for-europe.html
How Peace Between Afghanistan and the Taliban Foundered,https://www.nytimes.com/2016/12/26/world/asia/afghanistan-taliban-peace-talks.html
"Donald Trump, This Is Not Normal!",https://www.nytimes.com/2016/12/19/opinion/donald-trump-this-is-not-normal.html
Russia Turns Over American Cybertheft Suspect to the U.S.,https://www.nytimes.com/2016/12/15/world/russia-turns-over-cybertheft-suspect-joshua-samuel-aaron-to-the-us.html
U.S. Star Alex Morgan Heading to France to ‘Push My Game’,https://www.nytimes.com/2016/12/20/sports/soccer/us-star-alex-morgan-heading-to-france-to-push-my-game.html
"On College Campuses, Does ‘Liberal’ Mean ‘Illiberal’?",https://www.nytimes.com/2016/12/19/opinion/on-college-campuses-does-liberal-mean-illiberal.html
Alec Baldwin Returns to ‘S.N.L.’ as President-Elect Trump,https://www.nytimes.com/2016/11/21/arts/alec-baldwin-returns-to-snl-as-president-elect-trump.html
"Intent on Unsettling E.U., Russia Taps Foot Soldiers From the Fringe",https://www.nytimes.com/2016/12/24/world/europe/intent-on-unsettling-eu-russia-taps-foot-soldiers-from-the-fringe.html
Governor of Jakarta Issues Tearful Denial as Blasphemy Trial Opens in Indonesia,https://www.nytimes.com/2016/12/13/world/asia/jakarta-ahok-basuki-indonesia-blasphemy.html
Donald Trump’s New York Times Interview: Full Transcript,https://www.nytimes.com/2016/11/23/us/politics/trump-new-york-times-interview-transcript.html
How Egyptian ‘Democracy’ Really Works,https://www.nytimes.com/2016/12/21/opinion/how-egyptian-democracy-really-works.html
An Anti-Semitic ‘Troll Storm’ in Montana,https://www.nytimes.com/2016/12/20/opinion/an-anti-semitic-troll-storm-in-montana.html
"A Small African Nation Severs Ties with Taiwan, and Beijing Applauds",https://www.nytimes.com/2016/12/22/world/asia/china-taiwan-sao-tome-principe.html
South Korean Court Begins Hearings on Park Geun-hye’s Impeachment,https://www.nytimes.com/2016/12/22/world/asia/south-korea-president-park-impeachment.html
"Aleppo, China, Zsa Zsa Gabor: Your Monday Briefing",https://www.nytimes.com/2016/12/18/briefing/europe-briefing.html
What Unions Got Wrong About Trump,https://www.nytimes.com/2016/11/26/opinion/sunday/what-unions-got-wrong-about-trump.html
Gun Owners ‘Can Breathe Again’: Trump’s Win Emboldens Advocates,https://www.nytimes.com/2016/11/22/us/gun-supporters-trump.html
Out of Sorts Around the Holidays? It Could Be Family Jet Lag,https://www.nytimes.com/2016/12/22/well/family/out-of-sorts-around-the-holidays-it-could-be-family-jet-lag.html
The Soldier Donald Trump Called a Traitor,https://www.nytimes.com/2016/11/26/opinion/sunday/the-soldier-donald-trump-called-a-traitor.html
The Pretend Populism of Donald Trump,https://www.nytimes.com/2016/11/26/opinion/sunday/the-pretend-populism-of-donald-trump.html
"Prosecutors Drop Inquiry Into Charles Hynes, Former Brooklyn District Attorney",https://www.nytimes.com/2016/12/16/nyregion/prosecutors-drop-inquiry-into-charles-hynes-former-brooklyn-district-attorney.html
The Senate Bathroom Angle,https://www.nytimes.com/2016/12/22/opinion/the-senate-bathroom-angle.html
Is Donald Trump a Threat to Democracy?,https://www.nytimes.com/2016/12/16/opinion/sunday/is-donald-trump-a-threat-to-democracy.html
Rex Tillerson’s Special Friend in the Kremlin,https://www.nytimes.com/2016/12/22/opinion/rex-tillersons-special-friend-in-the-kremlin.html
The Evangelical Scion Who Stopped Believing,https://www.nytimes.com/2016/12/29/magazine/the-evangelical-scion-who-stopped-believing.html
‘Get Out of Your Gilded Offices and Fight for Change’,https://www.nytimes.com/2016/12/17/nytnow/top-10-comments-get-out-of-your-gilded-offices-and-fight-for-change.html
Why the Democrats Lost,https://www.nytimes.com/2016/11/20/opinion/sunday/why-the-democrats-lost.html
Bill English Is Chosen as New Zealand’s Prime Minister,https://www.nytimes.com/2016/12/11/world/australia/new-zealand-bill-english-prime-minister.html
What’s on TV Tuesday: ‘Tony Bennett Celebrates 90’ and ‘The Year: 2016’,https://www.nytimes.com/2016/12/20/arts/television/whats-on-tv-tuesday-tony-bennett-celebrates-90-and-the-year-2016.html
Richard Rorty’s 1998 Book Suggested Election 2016 Was Coming,https://www.nytimes.com/2016/11/21/books/richard-rortys-1998-book-suggested-election-2016-was-coming.html
Will 2017 Be the Year of Criminal Justice Reform?,https://www.nytimes.com/2016/12/16/opinion/will-2017-be-the-year-of-criminal-justice-reform.html
Trump’s Election? Some Students Are Too Busy to Worry,https://www.nytimes.com/2016/11/23/nyregion/trumps-election-college-students.html
"Romania Set for First Female, and First Muslim, Prime Minister",https://www.nytimes.com/2016/12/21/world/europe/sevil-shhaideh-romania-prime-minister.html
"De Blasio Is Fined $48,000 for Campaign Finance Violations",https://www.nytimes.com/2016/12/15/nyregion/de-blasio-is-fined-48000-for-campaign-finance-violations.html
North Carolina’s Partisan Rift Widens in Fight Over Governor’s Powers,https://www.nytimes.com/2016/12/15/us/new-north-carolina-governor-threatens-to-sue-state-gop.html
"Obama, Trump and the Turf War That Has Come to Define the Transition",https://www.nytimes.com/2016/12/23/us/politics/obama-trump-turf-war-transition-israel.html
Trump to Accept Inauguration Funds From Corporations and Big Donors,https://www.nytimes.com/2016/11/23/us/politics/trump-inaugural-donors.html
What We&#8217;re Reading,https://news.blogs.nytimes.com/2016/12/16/what-were-reading-215/
"Ukrainian Farmers, Poised for Growth, Stumble After E.U. Deal",https://www.nytimes.com/2016/12/23/business/ukraine-eu-agriculture-eggs-trade.html
Battle Lines Turn North Carolina’s Moderation Into a Distant Memory,https://www.nytimes.com/2016/12/23/us/north-carolinas-republican-legislature-governor.html
"Trump Summons TV Figures for Private Meeting, and Lets Them Have It",https://www.nytimes.com/2016/11/21/business/media/trump-summons-tv-figures-for-private-meeting-and-lets-them-have-it.html
Departing U.N. Leader Evasive on Possible Run for President of South Korea,https://www.nytimes.com/2016/12/16/world/asia/united-nations-ban-ki-moon-south-korea-president.html
"Growth, Not Forced Equality, Saves the Poor",https://www.nytimes.com/2016/12/23/business/growth-not-forced-equality-saves-the-poor.html
"Convicted of Sodomy, Malaysian Opposition Leader Loses Bid for Freedom",https://www.nytimes.com/2016/12/14/world/asia/malaysia-anwar-ibrahim-sodomy-court.html
Remembering Franca Sozzani: A Worldview That Mattered,https://www.nytimes.com/2016/12/23/fashion/remembering-franca-sozzani-italian-vogue-editor.html
‘Duck Dynasty’ vs. ‘Modern Family’: 50 Maps of the U.S. Cultural Divide,https://www.nytimes.com/interactive/2016/12/26/upshot/duck-dynasty-vs-modern-family-television-maps.html
"‘White Nationalism,’ Explained",https://www.nytimes.com/2016/11/22/world/americas/white-nationalism-explained.html
Inside a Fake News Sausage Factory: ‘This Is All About Income’,https://www.nytimes.com/2016/11/25/world/europe/fake-news-donald-trump-hillary-clinton-georgia.html
"To Boost the Economy, Help Students First",https://www.nytimes.com/2016/12/21/opinion/to-boost-the-economy-help-students-first.html
Trump Says U.S. Would ‘Outmatch’ Rivals in a New Nuclear Arms Race,https://www.nytimes.com/2016/12/23/us/politics/trump-nuclear-arms-race-russia-united-states.html
Co-Working Spaces Add a Perk for Parents: Child Care,https://www.nytimes.com/2016/12/23/realestate/co-working-spaces-add-a-perk-for-parents-child-care.html
"Dear America, Why Did You Let Us Down?",https://www.nytimes.com/2016/12/16/opinion/dear-america-why-did-you-let-us-down.html
Why This Election Was Not About the Issues,https://www.nytimes.com/2016/11/23/upshot/this-election-was-not-about-the-issues-blame-the-candidates.html
My Mexico City Is Everyone’s Now,https://www.nytimes.com/2016/12/28/travel/mexico-city-culture-childhood-new-awakening.html
Trump’s Win Helps Carve a Path to Washington for the ‘Cajun John Wayne’,https://www.nytimes.com/2016/12/17/us/politics/louisiana-clay-higgins-congress-cajun-john-wayne.html
Have Yourself a Merry Little 2017,https://www.nytimes.com/2016/12/24/opinion/sunday/have-yourself-a-merry-little-2017.html
"Aleksei Navalny, Putin Critic, Says He’ll Run for President of Russia",https://www.nytimes.com/2016/12/13/world/europe/aleksei-navalny-putin-president-russia.html
‘This Election Changed My Mind About America’,https://www.nytimes.com/2016/11/19/nytnow/top-10-comments-this-election-changed-my-mind-about-america.html
"Aleppo, Berlin, Russia: Your Morning Briefing",https://www.nytimes.com/2016/12/19/briefing/asia-briefing.html
Stock Surge Presents Risks for the Trump Administration,https://www.nytimes.com/2016/12/15/business/dealbook/stock-surge-presents-risks-for-the-trump-administration.html
"William Hudnut, Mayor Who Transformed Indianapolis, Is Dead at 84",https://www.nytimes.com/2016/12/18/us/william-hudnut-mayor-who-transformed-indianapolis-is-dead-at-84.html
"Berlin, Russia, Tupac Shakur: Your Tuesday Evening Briefing",https://www.nytimes.com/2016/12/20/briefing/berlin-russia-tupac-shakur.html
"Berlin, Uber, Donald Trump: Your Friday Briefing",https://www.nytimes.com/2016/12/23/briefing/europe-briefing.html
A Charity Auction for Coffee With Ivanka Trump Appears to Be Canceled,https://www.nytimes.com/2016/12/16/us/politics/donald-trump-transition.html
Grand Juries Said to Hear Testimony on Inquiries Into de Blasio Fund-Raising,https://www.nytimes.com/2016/12/15/nyregion/bill-de-blasio-investigation.html
How Trump Won the Troops,https://www.nytimes.com/2016/11/25/opinion/how-trump-won-the-troops.html
Readers Debate the Merits of Social Media Before and After the Election,https://www.nytimes.com/interactive/2016/11/18/fashion/reader-comments-twitter-facebook-presidential-election.html
Alt-Right Gathering Exults in Trump Election With Nazi-Era Salute,https://www.nytimes.com/2016/11/21/us/alt-right-salutes-donald-trump.html
How Could You? 19 Questions to Ask Loved Ones Who Voted the Other Way,https://www.nytimes.com/2016/11/18/podcasts/how-could-you-19-questions-to-ask-loved-ones-who-voted-the-other-way.html
The Populism Perplex,https://www.nytimes.com/2016/11/25/opinion/the-populism-perplex.html
Commerce Dept. to Revise Growth Figures; Nike and FedEx to Announce Earnings,https://www.nytimes.com/2016/12/18/business/commerce-dept-to-revise-growth-figures-nike-and-fedex-to-announce-earnings.html
Reddit and the God Emperor of the Internet,https://www.nytimes.com/2016/11/20/opinion/sunday/reddit-and-the-god-emperor-of-the-internet.html
Glenn Beck Is Sorry About All That,https://www.nytimes.com/2016/11/27/magazine/glenn-beck-is-sorry-about-all-that.html
George Soros Pledges $10 Million to Fight Hate Crimes,https://www.nytimes.com/2016/11/22/us/politics/george-soros-hate-crimes.html
I Voted Clinton. You Voted Trump. Let’s Talk.,https://www.nytimes.com/2016/11/18/podcasts/i-voted-clinton-you-voted-trump-lets-talk.html
"Russell Westbrook, Honorary Son of Oklahoma, Calls for Unity",https://www.nytimes.com/2016/11/19/sports/basketball/russell-westbrook-oklahoma-hall-of-fame.html
Trump Slaps Back at Bill Clinton and Links Three Attacks to Terrorism,https://www.nytimes.com/2016/12/20/us/politics/donald-trump-transition.html
Donald Trump and the C.I.A.,https://www.nytimes.com/roomfordebate/2016/12/19/donald-trump-and-the-cia
"Trump May Stay at His Hotel, Not Blair House, Before Inauguration",https://www.nytimes.com/2016/12/16/us/politics/blair-house-trump-inauguration.html
"Donald Trump, Aleppo, Yahoo: Your Wednesday Evening Briefing",https://www.nytimes.com/2016/12/14/briefing/donald-trump-aleppo-yahoo.html
"A New Gilded Age, for Artists Who Would Rule Forever",https://www.nytimes.com/2016/12/22/arts/design/our-midas-moment-from-galleries-to-artisans.html
"Corrections: December 17, 2016",https://www.nytimes.com/2016/12/16/pageoneplus/corrections-december-17-2016.html
Egyptian Novelist Jailed on Obscenity Charges to Be Released,https://www.nytimes.com/2016/12/18/world/middleeast/egypt-ahmed-naji-abdel-fattah-el-sisi.html
‘The Man in the High Castle’: An Alternative America Hits Home,https://www.nytimes.com/2016/12/15/arts/television/an-alternative-america-hits-home-in-the-man-in-the-high-castle.html
Donald Trump’s Israel Ambassador Pick Is Hazardous to Peace,https://www.nytimes.com/2016/12/16/opinion/donald-trumps-israel-ambassador-pick-is-hazardous-to-peace.html
"Trump Picks Mick Mulvaney, South Carolina Congressman, as Budget Director",https://www.nytimes.com/2016/12/16/us/politics/mick-mulvaney-office-management-budget-trump.html
"Donald Trump, the Fed and You",https://www.nytimes.com/2016/12/14/opinion/donald-trump-the-fed-and-you.html
"He Won’t Actually Take Away My Insurance, Will He?",https://www.nytimes.com/2016/12/15/opinion/he-wont-actually-take-away-my-insurance-will-he.html
Donald Trump and the Bieber Doctrine,https://www.nytimes.com/2016/11/21/opinion/donald-trump-and-the-bieber-doctrine.html
Want the Scoop on Team Trump? Pay Attention to Cindy Adams,https://www.nytimes.com/2016/12/21/fashion/cindy-adams-donald-trump-new-york-post-gossip.html
Who’s Responsible When Extremists Get a Platform?,https://www.nytimes.com/2016/12/13/magazine/whos-responsible-when-extremists-get-a-platform.html
Cornerstone: The Rise and Fall of a Health Care Experiment,https://www.nytimes.com/2016/12/23/business/cornerstone-the-rise-and-fall-of-a-health-care-experiment.html
"With Streaming, Musicians and Fans Find Room to Experiment and Explore",https://www.nytimes.com/2016/12/22/arts/music/streaming-album-bon-iver-kanye-west-frank-ocean.html
How Conservative Sites Turn Celebrity Despair on Its Head,https://www.nytimes.com/2016/11/22/arts/how-conservative-sites-turn-celebrity-despair-on-its-head.html
Financial Vetting Goes Slowly for Trump’s Wealthy Cabinet Picks,https://www.nytimes.com/2016/12/22/us/politics/financial-vetting-goes-slowly-for-trumps-wealthy-cabinet-picks.html
Trump Inches Toward Naming Domestic Cabinet Members,https://www.nytimes.com/2016/11/22/us/politics/donald-trump-transition.html
Invasion of the Agency Snatchers,https://www.nytimes.com/2016/12/22/opinion/invasion-of-the-agency-snatchers.html
Not a Republican Mandate,https://www.nytimes.com/2016/11/18/opinion/not-a-republican-mandate.html
Not Your Grandmother’s Wisconsin,https://www.nytimes.com/2016/11/22/opinion/campaign-stops/not-your-grandmothers-wisconsin.html
Clinton Campaign Demands Intelligence on Possible Russian Efforts to Elect Trump,https://www.nytimes.com/2016/12/12/us/politics/donald-trump-transition.html
"Donald Trump, Aleppo, Russia: Your Monday Evening Briefing",https://www.nytimes.com/2016/12/19/briefing/donald-trump-aleppo-russia.html
Donald Trump vs. the C.I.A. on Russia,https://www.nytimes.com/2016/12/12/opinion/donald-trump-vs-the-cia-on-russia.html
Women’s March and Bikers for Trump Claim Inaugural Demonstration Spots,https://www.nytimes.com/2016/12/12/us/politics/womens-march-bikers-trump.html
"Trump’s Son, Fearing ‘Quagmire,’ to Stop Soliciting for Charity",https://www.nytimes.com/2016/12/21/us/politics/eric-trump-charity.html
Trump Won. Still Moving to Canada?,https://www.nytimes.com/2016/11/24/fashion/social-qs-donald-trump-moving-to-canada-thanksgiving-dinner-clashes.html
Warning Russia on Hacking Isn’t Enough,https://www.nytimes.com/2016/11/24/opinion/warning-russia-on-hacking-isnt-enough.html
1992 | Gwen Ifill’s Cleareyed Coverage of Bill Clinton,https://www.nytimes.com/2016/11/18/insider/1992-gwen-ifills-cleareyed-coverage-of-bill-clinton.html
"Democrats, Let Your Leaders Emerge",https://www.nytimes.com/2016/11/17/opinion/democrats-let-your-leaders-emerge.html
"On Twitter, a Battle Among Political Bots",https://www.nytimes.com/2016/12/14/arts/on-twitter-a-battle-among-political-bots.html
"Norway and China Restore Ties, 6 Years After Nobel Prize Dispute",https://www.nytimes.com/2016/12/19/world/europe/china-norway-nobel-liu-xiaobo.html
"Health Exchange Enrollment Jumps, Even as G.O.P. Pledges Repeal",https://www.nytimes.com/2016/12/21/us/health-exchange-enrollment-jumps-even-as-gop-pledges-repeal.html
"Builders Tried to Rig a Vote and Take Over a Village, U.S. Indictment Says",https://www.nytimes.com/2016/12/15/nyregion/builders-tried-to-rig-a-vote-and-take-over-a-village-us-indictment-says.html
"Aleppo, Donald Trump, EgyptAir: Your Friday Briefing",https://www.nytimes.com/2016/12/16/briefing/europe-briefing.html
E.U. Reaches Compromise With the Netherlands on Closer Ukraine Ties,https://www.nytimes.com/2016/12/15/world/europe/european-union-netherlands-ukraine.html
Art and Museums in NYC This Week,https://www.nytimes.com/2016/12/15/arts/design/art-and-museums-in-nyc-this-week.html
"Aleppo, Donald Trump, Dylann Roof: Your Thursday Evening Briefing",https://www.nytimes.com/2016/12/15/briefing/aleppo-donald-trump-dylann-roof.html
A Brazen Power Grab in North Carolina,https://www.nytimes.com/2016/12/15/opinion/a-brazen-power-grab-in-north-carolina.html
The Not-So-Silent White Majority,https://www.nytimes.com/2016/11/17/opinion/the-not-so-silent-white-majority.html
Hillary Clinton Supporters Call for Vote Recount in Battleground States,https://www.nytimes.com/2016/11/23/us/politics/vote-count-hillary-clinton-trump.html
How Republics End,https://www.nytimes.com/2016/12/19/opinion/how-republics-end.html
"When Trump Meets Tech Leaders, Jobs Will Be on the Agenda",https://www.nytimes.com/2016/12/13/technology/when-trump-meets-tech-leaders-jobs-will-be-on-the-agenda.html
"Hillary Clinton, in Emotional Speech, Implores Supporters to Keep Believing in America",https://www.nytimes.com/2016/11/17/us/politics/hillary-clinton-in-emotional-speech-implores-supporters-to-keep-believing-in-america.html
To Be or Not to Be a Dictator,https://www.nytimes.com/2016/12/13/opinion/gambias-jammeh-weighs-whether-to-be-or-not-to-be-a-dictator.html
The Farmers We Forgot,https://www.nytimes.com/2016/11/23/opinion/the-farmers-we-forgot.html
"Bloomberg Says Cities Will Fight Climate Change, With or Without Trump",https://www.nytimes.com/2016/11/23/us/politics/mike-bloomberg-donald-trump-climate-change.html
‘Identity Politics’ and Its Defenders,https://www.nytimes.com/2016/11/21/opinion/identity-politics-and-its-defenders.html
What Donald Trump Doesn’t Know About Black People,https://www.nytimes.com/2016/12/17/opinion/sunday/what-donald-trump-doesnt-know-about-black-people.html
How Have People at Your School or in Your Community Reacted to the Presidential Election?,https://www.nytimes.com/2016/11/21/learning/how-have-people-at-your-school-or-in-your-community-reacted-to-the-presidential-election.html
Senate Aims to Stop Firms From ‘Buying Up Drugs and Jacking Up Prices’,https://www.nytimes.com/2016/12/21/us/politics/prescription-drug-prices.html
The City Could Have Saved This 6-Year-Old,https://www.nytimes.com/2016/12/16/opinion/the-city-could-have-saved-this-6-year-old.html
The In-Law in the Trump Inner Circle: Jared Kushner’s Steadying Hand,https://www.nytimes.com/2016/11/20/us/politics/jared-kushner-donald-trump.html
Loretta Lynch’s Parting Message,https://www.nytimes.com/2016/12/16/opinion/loretta-lynchs-parting-message.html
"Inside the Ku Klux Klan, With an A&E Documentary Series",https://www.nytimes.com/2016/12/18/arts/television/inside-the-ku-klux-klan-with-an-ae-documentary-series.html
"For Mitt Romney, Dinner and a Kiss-Off",https://www.nytimes.com/2016/12/15/opinion/for-mitt-romney-dinner-and-a-kiss-off.html
"Reince Priebus, Normalizer in Chief",https://www.nytimes.com/2016/11/27/magazine/reince-priebus-normalizer-in-chief.html
"Postelection Harassment, Case by Case",https://www.nytimes.com/2016/11/23/us/post-trump-how-people-explain-bias-based-attacks.html
"Corrections: December 15, 2016",https://www.nytimes.com/2016/12/14/pageoneplus/corrections-december-15-2016.html
Trump Still Hasn’t Named a Democrat to His Cabinet,https://www.nytimes.com/2016/12/16/us/politics/donald-trump-appointments-democrats.html
"Aleppo, Vladimir Putin, Donald Trump: Your Weekend Briefing",https://www.nytimes.com/2016/12/18/briefing/aleppo-vladimir-putin-donald-trump.html
The Two Americas of 2016,https://www.nytimes.com/interactive/2016/11/16/us/politics/the-two-americas-of-2016.html
Book Publishers Scramble to Make Sense of Trump’s Rise to Victory,https://www.nytimes.com/2016/11/22/business/media/book-publishers-scramble-to-make-sense-of-trumps-rise-to-victory.html
Russian Cyberforgers Steal Millions a Day With Fake Sites,https://www.nytimes.com/2016/12/20/technology/forgers-use-fake-web-users-to-steal-real-ad-revenue.html
Obama in Trumpland,https://www.nytimes.com/2016/11/16/opinion/obama-in-trumpland.html
