headline,url
Holocaust Survivors Score Victory in Reclaiming Stolen Art,https://www.nytimes.com/2016/12/10/us/congress-holocaust-nazis-stolen-art.html
The Final Vote for President: Learning About the Electoral College,https://www.nytimes.com/2016/12/08/learning/lesson-plans/the-final-vote-for-president-learning-about-the-electoral-college.html
"‘I’m Prejudiced,’ He Said. Then We Kept Talking.",https://www.nytimes.com/2016/12/10/opinion/sunday/im-prejudiced-he-said-then-we-kept-talking.html
"Goldman President Named Trump Adviser, Opening Door for Younger Executives",https://www.nytimes.com/2016/12/12/business/dealbook/goldman-sachs-gary-cohn.html
Gambians Face Uncertainty After President Rejects His Defeat,https://www.nytimes.com/2016/12/10/world/africa/gambia-election-yahya-jammeh-adama-barrow.html
"With Homeless Issue, Christine Quinn Gets Back in the Conversation",https://www.nytimes.com/2016/12/16/nyregion/christine-quinn-win.html
An Antidote to Donald Trump’s Secrecy on Taxes,https://www.nytimes.com/2016/12/12/opinion/an-antidote-to-donald-trumps-secrecy-on-taxes.html
"Friday Mailbag: The Veil, Storm Troopers and False Equivalence",https://www.nytimes.com/2016/12/16/public-editor/friday-mailbag-the-veil-storm-troopers-and-false-equivalence.html
Violence and Division on Chicago’s South Side,https://www.nytimes.com/2016/12/10/opinion/sunday/violence-and-division-on-chicagos-south-side.html
Some Same-Sex Couples Are Rushing to Say Their Vows. Just in Case …,https://www.nytimes.com/2016/12/09/fashion/weddings/same-sex-marriage-gay-couples-donald-trump.html
"Recreational Marijuana? Yes, but Tightly Regulated, Canadian Panel Suggests",https://www.nytimes.com/2016/12/13/world/americas/canada-recreational-marijuana-pot.html
"After Election Surprise, Marketers Rethink How to Study Consumers",https://www.nytimes.com/2016/11/15/business/media/advertisers-look-to-an-era-of-increased-data-and-fewer-facts.html
Did Moderates Help Elect Trump?,https://www.nytimes.com/2016/11/16/opinion/did-moderates-help-elect-trump.html
Trump’s Transition in a ‘Long History’ of Rocky Presidential Handovers,https://www.nytimes.com/2016/11/17/us/politics/obama-white-house-transition.html
L.G.B.T. Gamers Huddle for a Postelection Reality Check,https://www.nytimes.com/2016/11/20/style/lgbt-gamers-gaymerx-east-presidential-election.html
"A President Trump Excites, and Worries, Persian Gulf Leaders",https://www.nytimes.com/2016/12/12/world/middleeast/trump-persian-gulf-policy-egypt-iran-syria.html
South Korea Enters Period of Uncertainty With President’s Impeachment,https://www.nytimes.com/2016/12/09/world/asia/south-korea-president-park-geun-hye-impeached.html
"Fake News in U.S. Election? Elsewhere, That’s Nothing New",https://www.nytimes.com/2016/11/18/technology/fake-news-on-facebook-in-foreign-elections-thats-not-new.html
"Trump Is Said to Offer Interior Job to Ryan Zinke, Montana Lawmaker",https://www.nytimes.com/2016/12/13/us/politics/donald-trump-ryan-zinke-interior-secretary.html
Markets Sent a Strong Signal on Trump ... Then Changed Their Minds,https://www.nytimes.com/2016/11/19/upshot/markets-sent-a-strong-signal-on-trump-then-changed-their-minds.html
Trump’s Team Says He Sold All His Stocks in June,https://www.nytimes.com/2016/12/06/us/politics/donald-trump-business-stocks.html
"Review: ‘Table Manners,’ Chef Jeremiah Tower’s Guide for All Dining Challenges",https://www.nytimes.com/2016/12/13/books/review-table-manners-chef-jeremiah-tower.html
Where Will NASA Go in the Age of Trump?,https://www.nytimes.com/2016/12/12/science/nasa-donald-trump-moon-mars.html
"How to Argue Fairly and Without Rancor (Hello, Thanksgiving!)",https://www.nytimes.com/2016/11/17/health/how-to-argue-fairly-and-without-rancor-hello-thanksgiving.html
Center-Left Party Poised to Regain Power in Romania,https://www.nytimes.com/2016/12/11/world/europe/romania-election-social-democratic-party-psd.html
"As Trump Rises, So Do Some Hands Waving Confederate Battle Flags",https://www.nytimes.com/2016/11/19/us/confederate-flag-trump.html
"‘American Democracy Is Bigger Than Any One Person,’ Obama Says",https://www.nytimes.com/2016/11/17/world/europe/barack-obama-greece-donald-trump.html
European Populism in the Age of Donald Trump,https://www.nytimes.com/interactive/2016/12/05/world/europe/populism-in-age-of-trump.html
"After Trump’s Win, an Anxious Mexico Asks: What’s Next?",https://www.nytimes.com/2016/11/15/world/americas/mexico-donald-trump-enrique-pena-nieto.html
"Canada Wonders, if U.S. Balks, Is Carbon Pricing Still the Answer?",https://www.nytimes.com/2016/12/08/world/canada/canada-carbon-pricing-environment-energy.html
Trump’s Racial Time Machine,https://www.nytimes.com/2016/11/12/opinion/trumps-racial-time-machine.html
Turkey’s Populists See an Unlikely Ally,https://www.nytimes.com/2016/11/17/opinion/turkeys-populists-see-an-unlikely-ally.html
"Morning Agenda: Jitters Over Strong Dollar, Gun Control Coalition, Sci-Fi Financial Advisers",https://www.nytimes.com/2016/12/08/business/dealbook/us-dollar-gun-control-law-firm.html
Kanye West Visits Donald Trump,https://www.nytimes.com/2016/12/13/us/politics/kanye-trump-tower-visit.html
2016 Election Thank You Notes,https://www.nytimes.com/2016/11/13/opinion/sunday/2016-election-thank-you-notes.html
Facebook’s Damage to Democracy,https://www.nytimes.com/2016/11/16/opinion/facebook-vs-thomas-jefferson.html
Safety Pins Show Support for the Vulnerable,https://www.nytimes.com/2016/11/14/fashion/safety-pin-ally-activism.html
Globalism: A Far-Right Conspiracy Theory Buoyed by Trump,https://www.nytimes.com/2016/11/15/us/politics/globalism-right-trump.html
What We&#8217;re Reading,https://news.blogs.nytimes.com/2016/11/11/what-were-reading-205/
The Transition to President Donald Trump,https://www.nytimes.com/2016/11/12/opinion/the-transition-to-president-donald-trump.html
What E.U. Leaders Are Wrestling With at the End of a Tough Year,https://www.nytimes.com/2016/12/15/world/europe/european-union-eu-summit-meeting.html
New Presidents Who Tilt Toward Russia,https://www.nytimes.com/2016/11/16/opinion/new-presidents-who-tilt-toward-russia.html
"Paolo Gentiloni, Italy’s Foreign Minister, Will Try to Form a New Government",https://www.nytimes.com/2016/12/11/world/europe/italys-foreign-minister-will-try-to-form-a-new-government.html
Heng on Trump’s Election and Its Implications for China,https://www.nytimes.com/2016/11/14/opinion/heng-on-trumps-election-and-its-implications-for-china.html
Fed’s John Williams Feels Uncertainty Among Business Leaders,https://www.nytimes.com/2016/12/20/upshot/feds-john-williams-feels-uncertainty-among-business-leaders.html
Dylann Roof Found Guilty in Charleston Church Massacre,https://www.nytimes.com/2016/12/15/us/dylann-roof-trial.html
Iran and Boeing Sign $16.6 Billion Deal on Sale of 80 Aircraft,https://www.nytimes.com/2016/12/11/world/middleeast/iran-boeing-airplane-deal.html
"Morning Agenda: Trump and Wall Street, Wells Fargo Fallout, Beer Sales",https://www.nytimes.com/2016/12/13/business/dealbook/trump-goldman-wells-prudential-asahi-abinbev.html
"For Women, Glass Ceilings, and Glass Walls, Too",https://www.nytimes.com/2016/11/16/opinion/for-women-glass-ceilings-and-glass-walls-too.html
"Canada, Here I Come? First, Here’s Some Advice",https://www.nytimes.com/2016/11/12/opinion/canada-here-i-come-first-heres-some-advice.html
The Obama Economy Has Unfinished Business,https://www.nytimes.com/2016/12/15/upshot/heres-what-the-white-house-views-as-the-unfinished-business-of-the-obama-economy.html
Columbia Graduate Students Vote Overwhelmingly to Unionize,https://www.nytimes.com/2016/12/09/nyregion/columbia-graduate-students-union-vote.html
Facebook Mounts Effort to Limit Tide of Fake News,https://www.nytimes.com/2016/12/15/technology/facebook-fake-news.html
The Ghost Ship: It Could Have Been Any One of Us,https://www.nytimes.com/2016/12/07/opinion/the-ghost-ship-it-could-have-been-any-one-of-us.html
The Danger of a Dominant Identity,https://www.nytimes.com/2016/11/18/opinion/the-danger-of-a-dominant-identity.html
Trump and the Presidential Look,https://www.nytimes.com/2016/11/11/magazine/trump-and-the-presidential-look.html
The Democrats Screwed Up,https://www.nytimes.com/2016/11/13/opinion/the-democrats-screwed-up.html
Forget AT&T. The Real Monopolies Are Google and Facebook.,https://www.nytimes.com/2016/12/13/opinion/forget-att-the-real-monopolies-are-google-and-facebook.html
What Is America Without Influence? Trump Will Find Out.,https://www.nytimes.com/2016/12/13/opinion/what-is-america-without-influence-trump-will-find-out.html
"Morning Agenda: Trump and the Battlegrounds Ahead, Samsung and the Auto Industry",https://www.nytimes.com/2016/11/15/business/dealbook/trump-tax-fed-carrier-samsung.html
"Diplomatic, He’s Not. But Giuliani Might Be Our Top Diplomat.",https://www.nytimes.com/2016/11/16/nyregion/rudolph-giuliani-diplomat-cabinet-about-new-york.html
Statement on Trump Puts New Balance Shoe Company in Cross Hairs,https://www.nytimes.com/2016/11/16/business/statement-on-trump-puts-new-balance-shoe-company-in-cross-hairs.html
Make Colleges Diverse,https://www.nytimes.com/2016/12/13/opinion/make-colleges-diverse.html
A Time for Refusal,https://www.nytimes.com/2016/11/11/magazine/a-time-for-refusal.html
Partial Recount Ordered in North Carolina Governor’s Race,https://www.nytimes.com/2016/11/30/us/partial-recount-ordered-in-north-carolina-governors-race.html
"Latest Unpaid Trump Vendor Is His Own Pollster, Filing Shows",https://www.nytimes.com/2016/11/01/us/politics/tony-fabrizio-trump-vendor.html
Taiwan Is Both Exhilarated and Unnerved by Trump’s China Remarks,https://www.nytimes.com/2016/12/15/world/asia/trump-taiwan-china.html
Wary Drug Makers Move to Fend Off Further Attacks Under Donald Trump,https://www.nytimes.com/2016/12/09/business/donald-trump-drug-prices-pharma-stocks.html
"Under Donald Trump, Harsh Critic of V.A. May Become Its Leader",https://www.nytimes.com/2016/11/16/us/donald-trump-veterans-affairs-leader.html
"Meet Exxon’s Rex Tillerson, Trump’s Choice for Secretary of State",https://www.nytimes.com/2016/12/12/us/politics/rex-tillerson-facts-wiki.html
"The New Reality of TV: All Trump, All the Time",https://www.nytimes.com/2016/12/11/arts/television/the-new-reality-of-tv-all-trump-all-the-time.html
"Political Divide Splits Relationships — and Thanksgiving, Too",https://www.nytimes.com/2016/11/16/us/political-divide-splits-relationships-and-thanksgiving-too.html
End Winner-Take-All in the Electoral College,https://www.nytimes.com/2016/12/02/opinion/end-winner-take-all-in-the-electoral-college.html
"How Erie Went Red: The Economy Sank, and Trump Rose",https://www.nytimes.com/2016/11/13/us/politics/pennsylvania-trump-votes.html
The Varieties of Anger,https://www.nytimes.com/2016/11/13/opinion/sunday/the-varieties-of-anger.html
"António Guterres, Sworn In as U.N.’s Next Leader, Must Factor Trump Into His Plans",https://www.nytimes.com/2016/12/12/us/antonio-guterres-united-nations.html
Megyn Kelly’s Cautionary Tale of Crossing Donald Trump,https://www.nytimes.com/2016/11/16/business/media/megyn-kellys-cautionary-tale-of-crossing-donald-j-trump.html
Standing Up to a Strongman,https://www.nytimes.com/2016/12/11/opinion/standing-up-to-a-strongman.html
Goldman Sachs to Extend Its Reach in Trump Administration,https://www.nytimes.com/2016/12/09/business/dealbook/goldman-sachs-no-2-seen-as-a-top-economic-adviser-to-trump.html
How Donald Trump Will Divide American and Israeli Jews,https://www.nytimes.com/2016/11/13/opinion/sunday/how-donald-trump-will-divide-american-and-israeli-jews.html
Turkish Travel Warning Cautions Citizens About Travel to U.S.,https://www.nytimes.com/2016/11/15/travel/turkish-travel-warning-cautions-citizens-travel-united-states.html
Donald Trump Gets to Work,https://www.nytimes.com/2016/11/11/opinion/donald-trump-gets-to-work.html
Flawed Choices for the State Department,https://www.nytimes.com/2016/12/12/opinion/flawed-choices-for-the-state-department.html
‘We Have a Fake Election’: China Disrupts Local Campaigns,https://www.nytimes.com/2016/11/16/world/asia/beijing-china-local-elections.html
Donald Trump Loves New York. But It Doesn’t Love Him Back.,https://www.nytimes.com/2016/12/09/nyregion/donald-trump-new-york-protests.html
Louisiana Republican Wins Final U.S. Senate Seat in Runoff,https://www.nytimes.com/2016/12/11/us/john-neely-kennedy-louisiana-senate-runoff.html
The Myth of Female Solidarity,https://www.nytimes.com/2016/11/13/opinion/the-myth-of-female-solidarity.html
Business or Politics? What Trump Means for Cuba,https://www.nytimes.com/2016/11/16/world/americas/cuba-donald-trump.html
Michigan Voters Say Trump Could See Their Problems ‘Right Off the Bat’,https://www.nytimes.com/2016/11/13/us/politics/michigan-voters-donald-trump.html
"When Obama’s Gone, Who Will Stand Up for Democracy?",https://www.nytimes.com/2016/11/17/opinion/when-obamas-gone-who-will-stand-up-for-democracy.html
"Under Trump, the Federal Courts Will Be Up for Grabs",https://www.nytimes.com/2016/12/08/opinion/under-trump-the-federal-courts-will-be-up-for-grabs.html
Donald Trump Says His Company Will Do ‘No New Deals’ During His Term,https://www.nytimes.com/2016/12/12/us/politics/donald-trump-postpones-announcement-on-business-conflicts.html
Top of the Class,https://www.nytimes.com/2016/12/09/books/review/top-of-the-class.html
Putting the Polling Miss of the 2016 Election in Perspective,https://www.nytimes.com/interactive/2016/11/13/upshot/putting-the-polling-miss-of-2016-in-perspective.html
Trump Floats an Olive Branch: Might Keep Parts of the Health Law,https://www.nytimes.com/2016/11/11/us/politics/donald-trump-transition.html
American Companies Tailor Responses to Trump Election,https://www.nytimes.com/2016/11/12/business/american-companies-tailor-responses-to-trump-election.html
"Donald Trump, Aleppo, Golden Globes: Your Monday Evening Briefing",https://www.nytimes.com/2016/12/12/briefing/donald-trump-aleppo-golden-globe.html
"With Trump in Power, the Fed Gets Ready for a Reckoning",https://www.nytimes.com/2016/11/13/business/economy/trump-the-fed-yellen-gets-ready-for-reckoning.html
What Wellesley Stands For,https://www.nytimes.com/2016/11/16/opinion/what-wellesley-stands-for.html
Election 2016: Exit Polls,https://www.nytimes.com/interactive/2016/11/08/us/politics/election-exit-polls.html
"Trump Won the Election, but 3 Manhattan Buildings Will Lose His Name",https://www.nytimes.com/2016/11/16/nyregion/trump-won-the-election-but-3-manhattan-buildings-will-lose-his-name.html
"Obama, With Angela Merkel in Berlin, Assails Spread of Fake News",https://www.nytimes.com/2016/11/18/world/europe/obama-angela-merkel-donald-trump.html
"In Twist, Trump Victory Could Defang Anti-Establishment G.O.P. Caucus",https://www.nytimes.com/2016/11/14/us/politics/in-twist-trump-victory-could-defang-anti-establishment-gop-caucus.html
"For Le Pen, the Impossible Now Seems Possible",https://www.nytimes.com/2016/11/14/opinion/for-le-pen-the-impossible-now-seems-possible.html
"To Combat Trump, Democrats Ready a G.O.P. Tactic: Lawsuits",https://www.nytimes.com/2016/12/14/nyregion/donald-trump-democrats-lawsuits.html
Farhad’s and Mike’s Week in Tech: When the Tech Industry Lives in a Bubble,https://www.nytimes.com/2016/11/13/technology/farhads-and-mikes-week-in-tech-when-the-tech-industry-lives-in-a-bubble.html
"Obama Heads Overseas, Where Topic of Trump Will Follow Him",https://www.nytimes.com/2016/11/14/us/politics/obama-heads-overseas-where-topic-of-trump-will-follow-him.html
An American Mood,https://www.nytimes.com/interactive/2016/11/12/us/racerelated-election-art.html
Breaking Up With Twitter,https://www.nytimes.com/2016/11/13/fashion/breaking-up-with-twitter-presidential-election-2016.html
The 2016 Election,https://www.nytimes.com/slideshow/2016/11/08/us/elections/the-2016-election.html
Election Night Live Coverage,https://www.nytimes.com/interactive/2016/11/08/us/elections/trump-clinton-election-night-live.html
"For Trump’s Wealthy Cabinet, Prospect of a Sweet Tax Break",https://www.nytimes.com/2016/12/14/business/dealbook/for-trumps-wealthy-cabinet-prospect-of-a-sweet-tax-break.html
1964 | ‘Rightists Buoyed by the Election’,https://www.nytimes.com/2016/11/11/insider/1964-rightists-buoyed-by-the-election.html
Steve Bannon at the White House,https://www.nytimes.com/2016/11/15/opinion/steve-bannon-at-the-white-house.html
"After Park, Who? A Guide to Those Who Would Lead South Korea",https://www.nytimes.com/2016/12/09/world/asia/south-korea-who-could-replace-park.html
"As Progress Eludes Him on Social Issues, De Blasio Finds Success Elsewhere",https://www.nytimes.com/2016/12/14/nyregion/as-progress-eludes-him-on-social-issues-de-blasio-finds-success-elsewhere.html
Is the Slide Into Tribal Politics Inevitable?,https://www.nytimes.com/2016/11/18/upshot/is-the-slide-into-pure-identity-politics-inevitable.html
Mark Zuckerberg Is in Denial,https://www.nytimes.com/2016/11/15/opinion/mark-zuckerberg-is-in-denial.html
"Automated Pro-Trump Bots Overwhelmed Pro-Clinton Messages, Researchers Say",https://www.nytimes.com/2016/11/18/technology/automated-pro-trump-bots-overwhelmed-pro-clinton-messages-researchers-say.html
"Red, Blue and Divided: Six Views of America",https://www.nytimes.com/2016/11/14/us/red-blue-and-divided-six-views-of-america.html
"John Key, New Zealand’s Prime Minister, Says He Will Step Down",https://www.nytimes.com/2016/12/05/world/asia/new-zealand-prime-minister-john-key-resigns.html
With Success Comes Dissension in Italy’s Five Star Movement,https://www.nytimes.com/2016/12/12/world/europe/with-success-comes-dissension-in-italys-five-star-movement.html
The Divide Between Red and Blue America Grew Even Deeper in 2016,https://www.nytimes.com/interactive/2016/11/10/us/politics/red-blue-divide-grew-stronger-in-2016.html
Biggest Tech Failures and Successes of 2016,https://www.nytimes.com/2016/12/14/technology/personaltech/biggest-tech-failures-and-successes-of-2016.html
"Moving On, After a Rancorous Election",https://www.nytimes.com/2016/11/11/opinion/moving-on-after-a-rancorous-election.html
Available to the Highest Bidder: Coffee With Ivanka Trump,https://www.nytimes.com/2016/12/15/us/politics/ivanka-trump-charity-auction.html
How Federal Ethics Laws Will Apply to a Trump Presidency,https://www.nytimes.com/2016/11/12/us/politics/how-federal-ethics-laws-will-apply-to-a-trump-presidency.html
"For Republican Russia Hawks, a Dilemma Named Rex Tillerson",https://www.nytimes.com/2016/12/14/us/politics/rex-tillerson-russia-donald-trump.html
Daily Report: The Valley Awakens to Trump,https://www.nytimes.com/2016/11/11/technology/daily-report-the-valley-awakens-to-trump.html
The End of Identity Liberalism,https://www.nytimes.com/2016/11/20/opinion/sunday/the-end-of-identity-liberalism.html
North Carolina’s Sore Loser,https://www.nytimes.com/2016/11/30/opinion/north-carolinas-sore-loser.html
A Newly Vibrant Washington Fears That Trump Will Drain Its Culture,https://www.nytimes.com/2016/11/14/us/politics/a-newly-vibrant-washington-fears-that-trump-will-drain-its-culture.html
NBC Takes Over Thursday Night Football Amid Promising Signs in TV Ratings,https://www.nytimes.com/2016/11/15/sports/nbc-thursday-night-football-tv-ratings-nfl.html
Huffington Post Hires Senior New York Times Editor,https://www.nytimes.com/2016/12/06/business/media/huffington-post-hires-senior-new-york-times-editor.html
"To Our Readers, From the Publisher and Executive Editor",https://www.nytimes.com/2016/11/13/us/elections/to-our-readers-from-the-publisher-and-executive-editor.html
The Medicare Killers,https://www.nytimes.com/2016/11/18/opinion/the-medicare-killers.html
"U.S. Hate Crimes Surge 6%, Fueled by Attacks on Muslims",https://www.nytimes.com/2016/11/15/us/politics/fbi-hate-crimes-muslims.html
November Nights,https://www.nytimes.com/2016/11/13/fashion/parties-society-of-memorial-sloan-kettering-natural-resources-defense-council-the-metropolitan-museum-of-arts.html
"Israel’s Right, Cheering Donald Trump’s Win, Renews Calls to Abandon 2-State Solution",https://www.nytimes.com/2016/11/15/world/middleeast/israel-netanyahu-trump-palestinian-settlements.html
A Fat Dad Election,https://www.nytimes.com/2016/11/08/well/family/a-fat-dad-election.html
"U.K.’s Bridge to Trump? Nigel Farage, Who Pushed ‘Brexit,’ Posits Himself",https://www.nytimes.com/2016/11/15/world/europe/uk-donald-trump-nigel-farage.html
Trump and Obama Hold Cordial 90-Minute Meeting in Oval Office,https://www.nytimes.com/2016/11/11/us/politics/white-house-transition-obama-trump.html
"Xinjiang, Tense Chinese Region, Adopts Strict Internet Controls",https://www.nytimes.com/2016/12/10/world/asia/xinjiang-china-uighur-internet-controls.html
How the Polling Let Us Down,https://www.nytimes.com/2016/11/10/podcasts/how-the-polling-let-us-down.html
Election Day Choices,https://www.nytimes.com/2016/11/08/opinion/election-day-choices.html
‘A Moment of Great Peril’: Foreign Observers on Trump’s Success,https://www.nytimes.com/2016/11/11/world/trump-global-reaction.html
Readers Reflect on Michelle Obama’s Path to the White House — and What’s Next,https://www.nytimes.com/interactive/2016/11/11/fashion/michelle-obama-first-lady-reader-comments.html
"Greece, Seeking Dose of Stability, Is Rattled by Trump’s Win",https://www.nytimes.com/2016/11/15/world/europe/greece-trump-debt-relief.html
Subway Sticky Notes Offer Post-Election Therapy,https://www.nytimes.com/video/nyregion/100000004762238/subway-sticky-notes-offer-post-election-therapy.html
"Rudy Giuliani, America’s Mayor, Rolls the Dice",https://www.nytimes.com/2016/11/13/nyregion/giulianis-gamble-on-trump-pays-off-bigly.html
"Abortion Foes, Emboldened by Trump, Promise ‘Onslaught’ of Tough Restrictions",https://www.nytimes.com/2016/12/11/us/abortion-foes-donald-trump-restrictions-politics.html
"For Taiwan, a Dilemma Over Identity, Economy and China",https://www.nytimes.com/2016/12/13/world/asia/china-taiwan-shirley-lin.html
Trump’s Choice of Stephen Bannon Is Nod to Anti-Washington Base,https://www.nytimes.com/2016/11/15/us/politics/stephen-bannon-white-house-trump.html
Donald Trump in the White House: Will He Bring Steve Bannon With Him?,https://www.nytimes.com/2016/11/10/us/politics/transition-briefing-passing-the-presidency-to-donald-trump.html
Donald Trump Trolled Us All. We Should Learn From It.,https://www.nytimes.com/2016/11/14/opinion/campaign-stops/donald-trump-trolled-us-all-we-should-learn-from-it.html
"From Kanye West to the Midwest, Donald Trump’s Presidential Reality Show Rolls On",https://www.nytimes.com/2016/12/13/us/donald-trump-victory-tour.html
"South Korea’s Leader Offers to Quit in April, but It’s Unlikely to Be Enough",https://www.nytimes.com/2016/12/06/world/asia/park-geun-hye-south-korea-april.html
Trump’s Supreme Court List: Ivy League? Out. The Heartland? In.,https://www.nytimes.com/2016/11/15/us/politics/trump-supreme-court-justices.html
America Elects a Bigot,https://www.nytimes.com/2016/11/10/opinion/america-elects-a-bigot.html
Talking Trump on the Staten Island Ferry,https://www.nytimes.com/video/nyregion/100000004760383/talking-trump-on-the-staten-island-ferry.html
The Choice Confronting the Supreme Court’s Chief Justice,https://www.nytimes.com/2016/11/10/opinion/the-choice-confronting-the-supreme-courts-chief-justice.html
"When Melania Trump Met Michelle Obama, Their Clothes Did Some of the Talking",https://www.nytimes.com/2016/11/11/fashion/melania-trump-michelle-obama-narciso-rodriguez.html
How Trump Is Good for China,https://www.nytimes.com/2016/11/15/opinion/how-trump-is-good-for-china.html
The Marijuana Election,https://www.nytimes.com/2016/11/08/opinion/the-marijuana-election.html
The 2016 Election: An Audio Time Capsule,https://www.nytimes.com/2016/11/09/podcasts/the-2016-election-an-audio-time-capsule.html
Protests Erupt in Poland Over New Law on Public Gatherings,https://www.nytimes.com/2016/12/13/world/europe/poland-protests.html
"Protesters Take Anti-Trump Message to His Doorstep, and Plan Next Steps",https://www.nytimes.com/2016/11/13/us/trump-protest-rallies.html
Trump’s Victory Elicits Anger and Confusion in the N.B.A.,https://www.nytimes.com/2016/11/10/sports/basketball/carmelo-anthony-lebron-james-election.html
Our ‘Oracle’ Helps Us Process a Trump Presidency,https://www.nytimes.com/2016/11/10/podcasts/our-oracle-helps-us-process-a-trump-presidency.html
"Soak, Steam, Spritz: It’s All Self-Care",https://www.nytimes.com/2016/12/10/fashion/post-election-anxiety-self-care.html
Ten-Step Program for Adjusting to President-Elect Trump,https://www.nytimes.com/2016/11/10/opinion/ten-step-program-for-adjusting-to-president-elect-trump.html
"Their Leadership Lean, Democrats Turn an Eye to Rebuilding",https://www.nytimes.com/2016/11/10/us/politics/their-leadership-lean-democrats-turn-an-eye-to-rebuilding.html
Three Priorities for the New President,https://www.nytimes.com/2016/11/13/opinion/sunday/three-priorities-for-the-new-president.html
Lies in the Guise of News in the Trump Era,https://www.nytimes.com/2016/11/13/opinion/sunday/lies-in-the-guise-of-news-in-the-trump-era.html
What Whiteness Means in the Trump Era,https://www.nytimes.com/2016/11/13/opinion/what-whiteness-means-in-the-trump-era.html
The Doll in the Blue Pantsuit,https://www.nytimes.com/2016/11/13/opinion/the-doll-in-the-blue-pantsuit.html
Republicans in Congress Plan Swift Action on Agenda With Donald Trump,https://www.nytimes.com/2016/11/10/us/politics/republicans-congress-paul-ryan.html
When Republicans Take Power,https://www.nytimes.com/2016/11/13/opinion/sunday/when-republicans-take-power.html
